Comment,Date,Emotion
>addirittura (a opinione) necessario utile cosa?,2023-11-24,anger
"infatti, guardiamo cosa c'entra niente, terremoto finanziario successo islanda 10-15 anni fa, là gente fatto casino. concordo te, clima rabbia volte serve. citare bella frase orribile adattamento tv american gods, ""angry is good. angry gets shit done""",2023-11-24,anger
"sarà. clima rabbia solo giustificato addirittura (a opinione) necessario utile. grandi cambiamenti sociali avvenuti contesti rabbia, indignazione simili. mica pretendi chieda favore uccidere propria partner dice cose sgradite?",2023-11-24,anger
esattamente.,2023-11-24,sadness
"lei: ""pensi criminale"" lui: procede comportarsi criminale. fila perfettamente.",2023-11-24,anger
"giorno dopo l'arresto turetta raddoppiate chiamate 1522. colpa media, influencer donne sanno leggere dati, mica cultura patriarcale violenza deriva. comunque shout out signore questione perso tempo provare tesi avanzata moglie (ironia)",2023-11-24,anger
"paraocchi donne tornano uomo violento precendenti denunce. dover capire, colpire.",2023-11-24,anger
"stato lasciato perchè ""con te sento troppo sicuro"". stato tradito violento dopo disse ""tu troppo buono me merito essere presa schiaffi"" visto ragazze bellissime buona famiglia, voler forza stare boss quartiere l'hobby risse mani addosso gente senza motivo. farci figli farsi segregare casa, potendo uscire solo parenti. interrotto poco tempo fa frequentazione dopo averla sentita dire ex valeva nulla perchè ""se tagliavano strada suonavano semaforo scendeva ammazzare botte malcapitato"". e' mondo violenza piace moltissime donne. bravo ragazzo mansueto educato annoia. e' mondo donne scelgono. ecco mondo è.",2023-11-24,anger
"ah sí, cultura (100 persone l'anno) patriarcale (malattia mentale) colpisce ancora (é colpa tranne me)",2023-11-24,anger
"sostengo nemmeno l'hashtag #yesallmen, quindi proprio sbagliato mira.",2023-11-24,anger
"risposta seria reale: quest'uomo pazzo psicopatico incapace gestire proprie emozioni propri impulsi. l'avvocata ragione: quando cogliete segnali comportamenti problematici partner, agite immediatamente. risposta politicamente corretta: quest'uomo perfettamente sano mente, solo colpa patriarcato genetica, pur sempre uomo. l'avvocata ingenua qualunque uomo potenziale assassino.",2023-11-24,anger
"> vabbè ok, capito te interessa discutere considerato risposto, argomentando merito educatamente, direi proprio. diciamo piuttosto incontrato punto sai vuoi rispondere ulteriormente, preferisci uscirtene così. > addirittura utilizzi parte commento espongo trauma farla passare parte derido frase ""se vuoi buttarla trauma"" ambigua, significa chiaramente: tirato fuori trauma modo strumentale. risposta ""lo diresti vittima donna?"" dice tutto. > voluto portare esperienza personale, bene, allora posso farlo infatti contestato portare esperienza personale, differenza fatto me. > numeri lì sì, fatto un'interpretazione degna comizio fratelli d'italia. > spero tempo riuscirai capire necessariamente problemi altri invalidano incredibilmente ironico convinta idea, invece tua. idea \#yesallmen ""gli uomini devono farsi un'esame coscienza"" invalida vittime maschili e, generale, istituisce concetto responsabilità genere ingiusto dannoso. idea ciò valido ""i dati mostrano"", poi però quando contesta l'interpretazione dati glissi.",2023-11-24,anger
"vabbè ok, capito te interessa discutere, vuoi solo arrabbiarti qualcuno fatti tuoi, visto ignori lunghe parti commenti spiego argomento, addirittura utilizzi parte commento espongo trauma farla passare parte derido. intellettualmente onesto. limitavo farti notare vissuto l'ho vissuto io, me buona parte donne. parlando dati voluto portare esperienza personale, bene, allora posso farlo io. numeri lì, accessibili tutti, ognuno tragga conclusioni. dispiace molto accaduto, spero ottenga giustizia. spero tempo riuscirai capire necessariamente problemi altri invalidano tuoi, pare pensi.",2023-11-24,anger
"bene, quindi specificamente sottoscrivi l'hashtag \#yesallimmigrants?",2023-11-24,joy
"rispondo brevemente paragone immigrati. innegabile fenomeno criminalità commessa migranti esista, fenomeno che, guarda po', va affrontato livello sociale. l'educazione (fatalità, stessa cosa viene chiesta confronti uomini), l'integrazione, interventi inclusione sociale, ovviamente però devono essere accolti soggetti destinati, ovvero deve esserci volontà volersi integrare. razzista limita evidenziare problema dire immigrati brutti cattivi natura, bisogna buttarli fuori/non farli entrare. riconosce problema esiste cause sociali (disagio sociale, povertà, difficoltà accesso all' educazione, isolamento sociale, difficoltà adattamento contesto diverso proprio, percezione ostilità etc...), cause sociali deve intervenire. violenza donne cause sociali, bisogna intervenire, l'educazione, cambio cultura, consapevolezza certi modi pensare ragazzate, fondamentalmente sbagliati dannosi.",2023-11-24,anger
"> dati dimostrano problema sistemico violenze donne parte uomini esiste dimostrano nulla genere. meglio, ritieni dimostrino, allora vale altrettanto frase ""i dati dimostrano problema sistemico violenza italiani parte immigrati esiste"". senti sottoscriverla, fa accapponare pelle? > così difficile ammettere c'è problema riguarda uomini? c'è niente ammettere, né c'è problema riguarda ""gli uomini"". uomini categoria indistinta, idee, cultura mentalità. cosa un'ovvietà abbacinante, voilatri diventa necessario ribadirla. > dire uomini responsabili vuol dire ogni singolo individuo sesso maschile personalmente responsabile ogni atto molestia, violenza omicidio avviene, vuol dire però parte categoria tende mostrare comportamenti problematici, parte comunità, ogni individuo deve fare parte ridurre, stigmatizzare, impedire tali comportamenti. ""dire immigrati responsabili vuol dire ogni singolo individuo nazionalità straniera personalmente responsabile ogni atto molestia, violenza furto avviene, vuol però dire parte categoria tende mostrare comportamenti problematici, parte comunità, ogni individuo deve fare parte ridurre, stigmatizzare, impedire tali comportamenti."" fammi sapere responsabilità genere esiste nazionalità no (sperando che, oltre sessista, xenofoba). > poi vuoi buttarla trauma dici schifezze donne parlano proprie esperienze, meritano solo uomini?",2023-11-24,anger
"certo esistono, detto, cosa ovviamente guardato bene riportare, donne abusano commettono violenza esistono, vanno punite senza senza ma, giustificazioni. 600.000 vittime maschili esistono, vergogna ancora oggi riescano ricevere supporto bisogno. detto questo, dati dimostrano problema sistemico violenze donne parte uomini esiste. contrario no. poco lamentarti ""le 600.000 vittime maschili esistono"" quando giorni continuate dire esiste problema sistemico violenza donne, patriarcato c'entra niente. donne vittima violenza 5 volte numero uomini vittime stesso tipo violenza, entrambi casi autori uomini larghissima parte, così difficile ammettere c'è problema riguarda uomini? bisogna arrivare percentuale 100% ammettiate? dire uomini responsabili vuol dire ogni singolo individuo sesso maschile personalmente responsabile ogni atto molestia, violenza omicidio avviene, vuol dire però parte categoria tende mostrare comportamenti problematici, parte comunità, ogni individuo deve fare parte ridurre, stigmatizzare, impedire tali comportamenti. ogni volta sminuisce comportamento sbagliato, ogni volta dice ""ma si, ragazzata/ si, discorsi spogliatoio/ vuoi fare, ragazzi, normale"" alimenta problema. poi oh, magari anche, buon te, bravo, cambia problema consapevolezza educazione gruppo, *manca*. poi vuoi buttarla trauma, stata molestata volte, prima volta 12 anni, stara toccata senza consenso volte, insultata minacciata aver rifiutato avances, 70% popolazione femminile. ok, ignoriamo bellamente sproporzione finta vada bene.",2023-11-24,anger
"> secondo dati istat, donne quindi 600k vittime maschili esistono? > quindi si, uomini devono imparare fare violenza. 600k vittime maschili? > volete parlare violenze uomini? intanto parlatene sempre, solo quando serve sminuire rivendicazioni donne te cercate approfittare dell'onda emotiva momento imporre dicotomia falsa distruttiva. te insistessero stronzate tipo ""\#yesallmen"" alcun bisogno rispondervi facendovi notare stronzate. siccome fate, quei 600mila uomini zitto, incasso farvi piacere, smetto esistere favorire ideologia.",2023-11-24,anger
ben scritto! vogliono riflessioni ragionate questa.,2023-11-24,joy
"secondo [dati](https://www.istat.it/it/violenza-sulle-donne/il-fenomeno/violenza-dentro-e-fuori-la-famiglia/numero-delle-vittime-e-forme-di-violenza) istat, donne subito qualche forma violenza fisica sessuale 6.788.000. subito solo violenza sessuale 1.157.000. subito violenza (fisica sessuale entrambe) parte partner ex partner 2.800.000, vuol dire quasi 5 volte numero uomini subito stesso tipo violenza. entrambi casi, secondo studi riportati [qui](https://www.istitutobeck.com/abuso-uomini-trauma), l'87% abusanti confronti vittime sesso maschile uomo. 13% donna. quindi si, uomini devono imparare fare violenza. dati dimostrano certi comportamenti vengono messi atto un'amplissima maggioranza casi uomini, uomini, soprattutto donne. negare problema cultura educazione sessuale affettiva principalmente popolazione maschile negare l'evidenza. secondo [save the children ](https://www.savethechildren.it/press/violenza-contro-le-donne-il-70-delle-ragazze-dichiara-di-aver-subito-molestie-e-apprezzamenti) 70% adolescenti dichiara aver subito molestie almeno volta vita; secondo studio internazionale riportato [questo ](https://thevision.com/attualita/catcalling-molestie-donne/) articolo, contando catcalling molestie verbali, percentuale donne molestate propria vita sale all' 84%. dati [istat ](https://claudiamorelli.it/giustizia/dati-e-numeri-della-giustizia/femminicidio-violenza-sulle-donne-tutti-dati-italia/#:~:text=si%20stima%20che%20siano%208,subite%20negli%20ultimi%20tre%20anni.) relativi 2018, presi criteri stringenti, riportano 43,6% donne subito, propria vita, molestia sessuale, fronte 18,8% uomini. caso rileva autori larghissima maggioranza uomini, quando vittima donna, l'autore uomo 97% casi, quando vittima uomo, l'autore uomo nell'87% casi. volete parlare violenze uomini? intanto parlatene sempre, solo quando serve sminuire rivendicazioni donne, altrimenti date l'impressione realtà violenza uomini ve freghi proprio nulla. quando parlate parlatene voi, si, donne abusano commettono violenza esistono, vanno punite senza senza ma, alcuna giustificazione, numero ridottissimo rispetto uomini stesso, vittime entrambi sessi.",2023-11-24,anger
"purtroppo quando l'amore mescola relazione, razionalità tende andarsene quel paese maturato propria gestione sentimenti relazioni",2023-11-24,sadness
"oh l'amor cielo, te l'ho già spiegato, vediamo riesco spiegartelo meglio. primis usato l'hashtag #yesallmen, trovo inutilmente controverso, fa passare messaggio. messaggio è: no, uomini molestatori, abusanti, stupratori, assassini via dicendo, dovrebbe essere evidente. violenza donne perpetrata uomini problema esiste, deriva specifica cultura *tutti* cresciamo, incluse donne, fa certe idee mascolinità, possesso, onore etc spingano uomini essere sproporzionatamente violenti abusanti confronti donne, corrispondenti idee femminilità, gentilezza, sottomissione spingano donne essere vittime. cultura celebra ancora l'uomo ""forte"", arrogante prevaricatore, impone altri, persona cresce imbevuta cultura, probabile venga indotta adottare comportamenti abuso violenza confronti percepito debole, grande maggioranza casi donna, quantità minore casi altro uomo, magari visto inferiore ""femminuccia"". cosa cambia solo due cose: consapevolezza educazione, esattamente ""le femministe"", salvo qualche cretina, chiedono quando dicono uomini generale farsi un'esame coscienza, cresciuti ambiente inculcato certi valori, volenti nolenti *ne condizionati livello inconscio*, me inclusa. differenza donne maggiore stimolo possibilità (in spesso vittime) interrogarsi condizionamenti lavorarci sopra. uomini, tendenzialmente posizione potere privilegio, vivono certe situazioni stessa frequenza intensità donne, poco. persone particolarmente sensibili empatiche arrivano sole certe conclusioni, dopo aver purtroppo vissuto esperienze traumatiche, buona parte uomini bisogno qualcuno notare problema, modo tale possa partire riflessione quali elementi cultura patriarcale possono esistere lui. uomini stronzi, semplicemente vivi problema, nemmeno tanto stimolo analizzarlo risolverlo. spero essermi spiegata meglio scuso averti dato l'impressione aver sminuito trauma. voleva essere un'accusa confronti, semplice risposta piano emotivo, farti capire vissuto purtroppo frequentissimo donne. rendo conto aver usato parole facilmente fraintendibili, chiedo nuovamente scusa. fatto accaduto te infrequente va assolutamente sminuire gravità ciò accaduto, ribadisco qualsiasi uomo voglia parlare violenza traumi subiti uomini, desideri chiedere maggiore consapevolezza supporto confronti uomini vittime violenza, 100% supporto. uomini *devono* poter chiedere aiuto, devono poter essere presi serio, devono esserci risorse messe campo aiutare uomini vittime violenza. deve finire cultura cazzo (che comunque stessa identica cultura patriarcale rende donne vittime) deride l'uomo vittima abusi violenze, ride scherza quando ragazzino viene stuprato prof, viene picchiato donna, decide stare casa accudire figli, ciò dietro. chiedo solamente riflettere capire quando qualcuna dice ""fatevi esame coscienza"", ""educatevi"", ""prendete consapevolezza"", discorso livello sociale, inteso scritto sopra, accusando te personalmente.",2023-11-24,anger
"boh mai fortuna essere amato, però posso amare vuoi meni puoi andare cagare l'amore te..",2023-11-24,sadness
natura umana esista percentuale trascurabile persone (soprattutto uomini) violente egomaniacali. cosa facciamo?,2023-11-24,anger
"beh senso. forza volontà forza forte può muovere persona. utilizza uscire problema attivamente, alcuni problemi complessi possono risultare addirittura semplici risolvere. invece utilizza andare vuole aiutare, inconsapevolmente, c’è poco fare, forza volontà difficile contrastarla. forse giusto logica può forzare cambiamento, certe cose oggettive, lì, c’è sempre rischio persona dica “fatti cazzi tuoi” quando vuoi aiutare migliori intenzioni. cosa migliore viene mente fare prevenire, tipo fare regola gruppo propri amici cari “se dicono qualcosa, devi metterti discussione”. così sempre difficile, posizionano basi logiche buone discussione futura. grazie risposta comunque",2023-11-24,fear
"potrebbe essere un'idea, soluzione, esistono soluzioni semplici problemi così complessi. chiunque stato relazione abusi sa difficile staccarsi dall'altra persona spesso anni vogliano rendersene conto (a volte alcune persone rendono conto)",2023-11-24,sadness
"problema base persone vogliono farsi aiutare aiutare. esempio prendi persona soffre depressione: persona vuole farsi aiutare, nega avere problema quando notare certe cose arrabbia puoi aiutarla (o meglio puoi, estremamente difficile riesca ottenere qualcosa). persona tenendo comportamento oppositivo refrattaria qualsiasi cosa metta discussione stessa cosa vivendo. puoi mandarla migliori psicologi mondo, stessa prima persona remare direzione contraria spesso remo grosso tutti. esperienza, invita persona ragionare, maniera pacata senza insistere. persona rimane ferma convinzioni inamovibile poche cose puoi fare: solito rispondo ""non minimamente d'accordo, scelta vuoi fare appoggio pieno"". casi reso conto abusi aprire occhi, digerirli, avere quadro chiaro cose agire conseguenza serve tempo. ricorda persona subisce abuso facile tenda chiudersi/allontanare tutti, pensi persona conosci vittima abusi cerca starle vicina porta pazienza: andrà bene fra paio d'anni bervi birra pub ridere momenti andrà male fatto possibile nessuno può salvare qualcun altro stesso",2023-11-24,fear
cope,2023-11-24,sadness
quindi cosa può fare società? allontanare vittima forzatamente?,2023-11-24,anger
"domando sinceramente, quel punto fai? dicono allontanarti, il/la partner continuano avere comportamenti violenti, tossici e/o pericolosi, convivenza continua. quel punto fare? sembra capire persona prima poi muore, viene irrimediabilmente traumatizzata comportamenti partner arriva deus ex machina salva persona questione. cosa può fare casi? chiedo giorno accadesse persona me cara vorrei poterla aiutare, però onestamente posta l’hai posta commenti sembra c’è opzione lasciare persone triste destino",2023-11-24,sadness
"[prendi nome cognome, poi processo direttissima](https://cdn-img-r.facciabuco.com/54/1h82gkbtf8-ggzw0_c.jpg)",2023-11-24,anger
"premetto: chiedo scusa wall of text, molto contento risposta :) chiedo cortesia reagire male post, persona passato me eventi traumatici voglio assolutamente girare coltello piaga. >questo livello provvedimenti legislativi. livello società civile, concentrerei stigmatizzare, boicottare fare pezzi strumenti sdegno pressione pubblica quei media perpetuano propagandano stereotipi de ""la gelosia affascinante"" ""la possessività attizza"" perfetto, grazie! >stigmatizzare gruppo complessivamente responsabile efferati crimini secondo te odio? infatti favore stigmatizzazione consapevole varie realtá violenza (inclusa perpetrata stessi). personalmente ignoro abbondantemente urla estremiste tiktok gym compilation simili, ritenendo sí fenomeni intollerabili spesso raggiunge top dell'algoritmo é divisivitá contenuto. fatto, ideali fortemente allineati tuoi, vedendo proposte, penso allineati maggior parte donne conosco. ovvio alcuni messaggi passano esagerati é all'interno sfere protesta, é bene cercare spostare conversazione ciò é d'accordo prima cosa, poi caso cercare spiegarsi cuore calmo é disaccordo messaggio. >""io odio neri, bene raccomando essere responsabili cultura cultura delinquenza"" frase potrebbe uscire comizio lega infatti penso sinistra (e molti progressisti) fortemente biasimare mancanza razionale conversazione topic. é vero aspetti culturali aumentano rischio escandescenze violenze é stesso tempo vero disperazione povertá spingono persone atti impensabili. stesso modo, topic mascolinitá stato efficacie veicolare messaggio diretto ""quegli aspetti mascolinitá"" aumentano outburst violenza. ovvio storia tragica giulia (da conregionale l'ho sentita molto forte) risuona tutte donne almeno volta vita sentite spalle muro quindi molte reazioni emotive.",2023-11-24,anger
"> é problematico solo approccio prevede odio confornti gruppo danneggiante. stigmatizzare gruppo complessivamente responsabile efferati crimini secondo te odio? ""io odio neri, *per bene* raccomando essere responsabili cultura cultura delinquenza"" frase potrebbe uscire comizio lega. > ok, sarcasticamente, proporresti di? educazione all'affettività obbligatoria scuole, campagne informazione individuare comportamenti ossessivi possessivi precocemente, soprattutto codice rosso funzionante permetta vittime ricevere vera protezione. cominciare dall'ordine allontanamento accompagnato dall'obbligo braccialetto elettronico, oggi praticamente dimenticato, caso seri indizi colpevolezza attivi persecutori violenti. livello provvedimenti legislativi. livello società civile, concentrerei stigmatizzare, boicottare fare pezzi strumenti sdegno pressione pubblica quei media perpetuano propagandano stereotipi de ""la gelosia affascinante"" ""la possessività attizza"".",2023-11-24,anger
"é problematico solo approccio prevede odio confornti gruppo danneggiante. va specificato é tratta messaggio neutro, tentativo cambio socioculturale. >veicolato determinate mentalità ok, sarcasticamente, proporresti di? capito te problema é renderla questione genere giusto? allora quali altre variabili gioco? sarcastico ironico, terrei che, apre dialogo, carte tavola ben poste :)",2023-11-24,anger
"> siccome ambo sessi, genere perpetua violenza é preponderante maschile, allora é bene messaggio forte chiaro venga veicolato uomini no, bene messaggio forte chiaro venga veicolato determinate mentalità. stesso pseudo-ragionamento legittimo anzi doveroso fare campagna stampa diretta nazionalità straniere responsabili numero altamente sproporzionato crimini. ""magrebini, imparate delinquere!"" vedi, sembra bella cosa? magrebini delinquenti, ossia ovviamente stragandissima maggioranza, dovrebbero stare zitti anzi applaudire cosa genere?",2023-11-24,anger
"occhio, attorno 20% donne commettere violenze uomini. quindi, toglie realtá abuso psico-fisico parte donne uomi, siccome ambo sessi, genere perpetua violenza é preponderante maschile, allora é bene messaggio forte chiaro venga veicolato uomini. parlo ragazzo é stato molestato stuprato rispettivamente donna uomo all'etá 7 8 anni, tutte violenze vanno fermate prevalente é maschile.",2023-11-24,anger
"attenzione, vero 70 90% accuse violenza parte donne risultano infondate. gonfiano dati creano percezione emergenza, facilitando ulteriori tensioni reali immaginate. chiaramente deve portare cedere violenza generale analizzare problema punti vista trovare soluzioni efficaci.",2023-11-24,anger
"> allora visto appurato guerra sessi, noterai quando parla suicidi, vittime violenza domestica maschile fa soprattutto contesti parla femminicidi comunque vittime femminile. mica discussioni vengono impostare 99% volte ""guerra fra sessi"", dare quadro completo fondamentale smontare quel paradigma? > cerchiamo costruire belle discussioni scevre dall'odio visto odio parte fin qui?",2023-11-24,anger
"allora visto appurato guerra sessi, noterai quando parla suicidi, vittime violenza domestica maschile fa soprattutto contesti parla femminicidi comunque vittime femminile. personalmente, quando notizie sensibilizzano notizie (al maschile) vedo sempre commenti solidali ambo sessi (me compresa). cosa volevo sottolineare vita giorni minimizza reprime sofferenza maschile, prende giro fa nulla sempre persone alimentano sempre stessa ideologia cerchiamo individuare combattere, fitta, vecchia millenni profondamente malsana. perciò l'ideologia vuoi combattere proprio stessa combattiamo noi. cerchiamo costruire belle discussioni scevre dall'odio solo aiuto, ascolto comprensione",2023-11-24,anger
"""il 39% ragazzi ragazze italia esposti online contenuti giustificano violenza donne, forbice allarga 31% maschi 48% femmine"" cazzo dato 😂😂😂",2023-11-24,anger
"""una grossa sproporzione molestie violenze danno donne"" falso maggior parte violenze fisiche subite maschi, maggior parte molestie sessuali subite donne, entrambi casi maggior parte autori uomini secondo statistiche, sebbene numeri reali violenze fisiche psicologiche danno uomini parte donne vengano denunciati né raccolti nessun ente ufficiale, dunque può fare comparazione attendibile.",2023-11-24,anger
"no, minaccia verbale risulta molestia, impara leggere cose bene invece fare cherry picking. riportato mix dati basati denunce self reported esattamente poter avere visione d'insieme controbilanciare limiti entrambi metodi, guarda po', concordi nell' evidenziare grossa sproporzione molestie violenze danno donne, concordi fatto uomini larghissima parte autori. istituzioni intere dedicate fare ricerche, esperti settore lavorano dentro, arriva tizio caso reddit decide irrilevanti. favore, su.",2023-11-24,anger
citi tutte stime (dunque irrilevanti) interviste campione minaccia verbale risulta violenza. mai stato minacciato verbalmente vita? ergo dati totalmente irrilevanti.,2023-11-24,anger
"parlavo generale, proprio dici discussioni vengono impostate percepite male, bello cosa impostata male trae qualcosa beneficio senza odio rabbia",2023-11-24,anger
"> guerra sessi d'accordo, infatti chiedendo porla termini. > sentirti attaccato zittito discussione intervenuto l'interlocutrice afferma ""parlate violenza uomini solo quando serve sminuire donne"". ""sento"" zittito, tentativo zittirmi lì nero bianco.",2023-11-24,anger
"ripeto, situazione simile riconoscevo cosa, amici ripetevano cosa, comunque persona. spesso situazioni riconoscono, ignoriamo fa parte natura",2023-11-24,sadness
"infatti dicendo colpa vittima, proprio bisogna azioniamo aiutarla riconoscere situazioni.",2023-11-24,anger
"certo, richiede tempo. tempo persona rende conto cosa (che volte può richiedere anni) spesso succedono cose",2023-11-24,sadness
"> natura umana cosa evitabile balle. comportamento umano altamente condizionato convinzioni, convinzioni malleabili. ""non posso lasciarlo, padre figli"", ""l'ha fatto tiene troppo me"" compagnia cantante pensieri può deve far propaganda.",2023-11-24,anger
"smettetela trattare donne amebe prive libero arbitrio forza d'animo. dipingete tutte pupazzi senza volontà né palle sempre solo balia circostanze, senza mai prendere alcuna decisione. poveretta chiaramente deciso tornare marito, nonostante denuncia. potremmo ipotizzare ore fatto fine conti stata scelta finale farlo. colpa ovviamente stata ammazzata ovviamente aspettava fare finta cosa stata diretta conseguenza pessima scelta aiuta nessuno risolvere problema elimina qualunque possibilità discussione. tornata marito manipolata? andare? reddito? semplicemente voleva? problemi andrebbero affrontati analizzati singolarmente zittire qualsiasi discussione dicendo ""non fa victim blaming"" porterà risoluzione nessuno quei problemi.",2023-11-24,anger
quindi donne vanno trattate amebe incapaci intendere volere? rispetto pretendete? essere trattate eterne bimbe sciocche?,2023-11-24,anger
">tutto uomini devono imparare fare violenza. oh no, risiamo",2023-11-24,anger
davvero? dà dati giusti istat save the children? cuggino?,2023-11-24,anger
