Comment,Date,Emotion
"devi ricominciare basi, problema femminicidio é numerico, culturale. donne italia considerate proprietá parte compagni fin troppo spesso vengono uccise provano farsi vita allontanarsi. dire tassi omicidi fra piú bassi europa donne vengono uccise meno termini proporzionali senso, donna corso rapina viene uccisa é femminicidio...se donna viene uccisa partner mollato, si..non diventare complice melma informe misogini inondando sub giorni",2023-11-20,anger
">(*""non oggettificarmi mentre mostro buco culo onlyfans""*). potevi scrivere ""non so (\*) cosa consenso"" fatto prima (\*) balle, appena capita te vedi bene capisci applichi >acquisire peso assolutamente preponderante società [citation needed]",2023-11-20,anger
risposta me salvo é esattamente intende “yes man” ignavo.,2023-11-20,anger
"_and this, kids, is why the planet collapsed_",2023-11-20,joy
"educhi solo figli, vivi società importa. educa proprio comportamento, imparare tramite l'emulazione comunissimo, educa posto lavoro, pari, piccoli grandi.",2023-11-20,anger
meglio 5 anni averne proprio.,2023-11-20,sadness
"perchè parla donne uccise? persone uccise? forse spostando discorso piano oggettivo, quindi introdurre concetto magari forza fisica rispetto sesso dire, male. tanti uomini molto esili deboli togli sesso m d, subiscono stesso trattamento. sempre italia lascia trasportare moda momento",2023-11-20,anger
"eh già, fatto donne puramente incidentale, no? so fate scrivere certe cose serietà",2023-11-20,anger
"200 omicidi finora italia 65 donne, resto uomini. cos'è omicidio donna vale uomo? fammi capire",2023-11-20,anger
"complimenti, stessa comprensione questioni genere bambino cinque anni.",2023-11-20,joy
"quando puoi attaccare l’argomentazione, attacchi persona. “piagnistei ridicoli”, “state zitti”, sembrano molto frasi mansplanning femminismo condanna pronunciarle uomini. qui nessuno piange. rendiamo semplicemente conto fronte squilibrio enorme narrazione media, punta creare empatia donna vista sempre vittima innocente l’uomo nemico società contemporanea zero empatia. odio tifoserie, odio bandiere. voglio mondo anti-sessista violento. permetto criticare lente femminismo comunicazione giornalisti.",2023-11-20,anger
"dimmi po’, uomini stati uccisi compagne, italia mondo? temono finire morti ammazzati lasciano donna? parla femminicidio tiri fuori “donna sempre vista vittima innocente”; quindi pensi cercata? cosa cercando dire, esattamente? parla circa cento donne uccise *in donne* vai “not men”, dà fastidio parli problema donne provino rabbia. dimostri grande incapacità provare empatia, complimenti.",2023-11-20,anger
"figli sani sistema, giornata tipo italia sgozzamento rituale collettivo donne piazze piena luce giorno.",2023-11-20,anger
"stesso commento fatto quei post sessisti, mascherati buone intenzioni. ""non musulmani terroristi, terroristi musulmani"". stesso ragionamento osceno fallacia logica. cambiate parole post, togliendo ""uomini"" mettendo altri gruppi persone, renderete conto discriminatorie affermazioni. sogneremmo mai dire ""dobbiamo educare musulmani"" giustamente. segno pregiudizio enorme. evidentemente misandria, invece, va molto moda. uomini portano sé peccato originale essere ""privilegiati"" devono essere messi riga. ogni omicidio orrendo va condannato, post cavalcano alimentano senso panico collettivo ingiustificato dati, sfruttando vittime. cosa rattrista alimentano paura guerra sessi.",2023-11-20,anger
"piagnistei ridicoli, parla donne uccise compagni già sentite messi rogo… assassini “mostri” deviati, figli sani patriarcato, fatto notare sorella vittima. molto penoso donna chiedersi prossima, imbarazzanti.",2023-11-20,anger
"me sembra recentemente esseri umani soffrendo vivendo vite ritmi insostenibili primis permettono farci pensiero proprio riflettere alcuni aspetti società vista mole informazioni distrazioni poco tempo libero , sembriamo frustrati giocano nasconderlo riservano frustrazioni verso minoranze immaginarie conosciamo . patriarcato l’immigrato terrorista sempre complotto quando fa comodo sembra dobbiamo trovare forza valvola sfogo scaricare problemi società percepiamo po’ nota noto … forse sempre stato così masse mai rappresentato grande intelligenza collettiva , forse ora risulta amplificato modo sentire pareri così tante persone sconosciute così tanti input fine giornata sembra essere immersi palude ignoranza inconsapevolezza ??? penso ogni uomo responsabile proprie lacune tempo stesso viviamo mondo sempre difficile emergere palude … riesco dare neanche colpa tutta gente sa avere ragionamento razionale imparziale , dovessi prendermela metterei stesso livello , dovremmo prendercela piuttosto tutte persone approfittano bussness notizie fake news titoli acchiappa reazioni altro portare disinformazione confusione ignoranza , quei programmi tv faziosi palesemente recite hoc raccontare versioni intrattenere distrarre massa verso ciò tira momento senza fare vera informazione , quei politici ormai decenni politica recitano ruoli , suon slogan battute acchiappa consensi cercano vincere solo corsa consensi rivali , quando poi magari neanche titoli studio , capacità , esperienza qualsiasi cosa . altrimenti ogni caso mediatico qua dire stufi quel gruppo persone pensa così. no stufo stare mondo sembra apparenza finto , sembra volerti doverti convincere , veniamo trattati animali addomesticare intellettualmente …",2023-11-20,anger
stampo incornicio commento,2023-11-20,joy
"assolutamente ragione, guarda dovrebbero seriamente scusarsi entrare stato derubare. \*ammicca ammicca\*",2023-11-20,anger
[gif](emote|free_emotes_pack|upvote),2023-11-20,joy
"> guardo mondo intero solidale commuove coro filmati massacri osceni tanti primi piani mamme bambini vien dire amore molto meglio essere buoni. così cantava gaber, canzone appartenenza. falsi pianti coro, finta compassione proprio l'opposto bontà, pura ipocrisia",2023-11-20,anger
porella fa poco laurea cimitero,2023-11-20,anger
serve genitori voleva bene elaborare lutto.,2023-11-20,sadness
"nulla stupirsi purtroppo. reddit genitori colpa qualunque cosa, sempre comunque. genitori possono educarti meglio dentro te provi 0 empatia altri esseri umani remore spezzare vite ""torto"" subito c'è educazione tenga.",2023-11-20,sadness
"senza prendere considerazione dolore due famiglie lacerate evento, pure padre giulia espresso vicinanza famiglia filippo.",2023-11-20,sadness
"basita, commenti letto moltissimi dire colpa genitori ancora madre. capisco l'educazione l'esempio parte importante personalità, deresponsabilizzare così assassino vera follia: c'è educazione mondo fa oltrepassare certi limiti.",2023-11-20,anger
"cosa esclude l'altra. laurea dovuta rispetto confronti, discorsi politici stesso (sull'educazione all'affettività es.) lasciano tempo trovano visto metà parlamento pensa eliminare reati forza inasprimenti pene.",2023-11-20,anger
"senza niente togliere grave fatto successo, scassate cazzo fare finti paladini giustizia scia media vari portano all'esasperazione ogni dramma solo fare po' audience click più? credo gente pensa davvero hashtag possa cambiare natura dell'essere umano, 2000 passa anni gente ammazza cose stupide cambiare cosa. successa cosa terribile, forze dell'ordine compagnia bella han fatto lavoro. basta. smettetela fare cazzo pettegole paese. storia riguarda, storia riguarda nessuno famiglie coinvolte. venitemi dire fate ""fare vedere problema tutti"", settimana ricorderete nemmeno successo. po' migliaia persone morte ucraina, ormai fa notizia, giusto?",2023-11-20,anger
"allora posso capire caso trova davanti momenti spiacevoli generale (orami sentendo troppo giro) nessuna responsabilità dell'educazione nessuno. interesse competenza educare, perchè figli",2023-11-20,sadness
"letto istigazioni all’odio, letto frustrazione percepiscono mine vaganti. rendi conto puoi uscire ragazza, colpa altri deficienti, sente mina vagante? fa incazzare? me sì. colpe donne sentono così, colpa innumerevoli casi stati. colpa atteggiamento uomini (non donne) soprassiedono piccole cose, potere parole.",2023-11-20,anger
"chiaro modo femminicidio giustifichi comportamento varie ""aspiranti salvini"" sciacallaggio vicenda, sfruttando l'emotività collettiva donne istigandole all'odio un'intera categoria persone, base tratti identitari.",2023-11-20,anger
"concordo, solo sminuirne gesto",2023-11-20,anger
"d'accordissimo, parlavo ""folle"", jna parte può essere inteso ""incapace intendere volere"" dall'altra può essere usato insulto . senso definirlo folle inteso ridurne colpa, solo sfogo personale",2023-11-20,anger
omicidi genere. cosa chiaro? grazie downvote :),2023-11-20,joy
"genio male? parlando? l'ha pestata (atto ripreso video) poi lungo fuga accorto averla fatta grossa deciso uccideva riusciva scappare, secondo l'autopsia stata colpita 20 coltellate. 20 colpi coltello certo cosa sicuro sé preparato prima, mai letto qualcosa puoi già capire aumenta numero colpi, probabile gesto dovuto livello panico crescente. tizio quindi probabilmente povero idiota viziato livello emotivo propria famiglia (e capisce interviste famiglia stessa), mai imparato accettare rifiuto",2023-11-20,fear
"diciamo mezzo genio male fallito. piano studiato sicuro, male l'ha fatto prima. poi onestamente manco saprei tiene coltello devi dare colpi, quindi fatto consciamente l'intenzione. qualche scossa bella sedia gliela darei",2023-11-20,anger
"idiota comunque definizione legale. reo confesso colpevole, altrimenti indagato (ma direi abbastanza prove circostanziali...), colpevole omicidio assassino. sicuramente problemi persone normali uccidono, comunque definirei idiota.",2023-11-20,anger
filippo assassino idiota pensare scappare giustizia,2023-11-20,anger
risulta richiedere aiuto necessario incitare all'odio criminalizzando intero gruppo base determinati tratti identitari.,2023-11-20,anger
"soluzione educare ,in modo mezzi riconoscere campanelli d'allarme mano persone possibile. intendo educare davvero, banalità sterili propinano media ogni volta succede qualcosa ( curare meglio prevenire, cose ora pare)",2023-11-20,anger
"anzitutto mai detto affibbiato, solo riconosciuto dato fatto: c’è parte naturale predisposizione essere violenti sesso maschile piuttosto femminile motivo biologico fondo. realtà scientifica. https://www.ncbi.nlm.nih.gov/pmc/articles/pmc3693622/#:~:text=testosterone%20activates%20the%20subcortical%20areas,testosterone%20to%20reduce%20its%20effects. luce questo, cultura potrà mai azzerare fondo dovuto natura, quindi uomini sempre spesso rispetto donna coinvolti crimini violenti. solo femminicidi, robe guerra, mafia, faide gang ecc. crimini violenti c’è forte sproporzione uomini, solo motivazioni culturali. detto questo, trova pure quel detto adesso quel vuoi, dimmi pure scritto normale uccidere donne, avanti. disonestà intellettuale pura tua.",2023-11-20,anger
">non risolverà mai uomini solo intenzione risolverlo, l'istinto violento parte natura. ammettendo possibile eliminare predisposizione essere violenti data testosterone (che so nemmeno vera, punto altro) resterà sempre parte persone mentalmente instabili, testosterone no, ucciderà va. può ridurre 0 numero omicidi (in generale, solo femminicidi) pensi veramente possibile avere società letteralmente 100% persone ucciderà persona?",2023-11-20,anger
"quindi soluzione sarebbe? tenervi legati cortile pitbull, dato grandi istinti animaleschi? dopo l'hai detto pure tu, problema femminicidi risolverà mai uomini solo intenzione risolverlo, l'istinto violento parte natura. comunque fa ridere uomini capaci strillare ""non capaci omicidio, nazifemministe dimmerda"" poi ve usciate ""ma testosterone, ammazziamo gente. normale."" l'altro, giovanni.",2023-11-20,anger
"conto definizione legale, altro dispregiativa viene attribuita sede meno ufficiale (credo)",2023-11-20,anger
"appunto: pure premeditato l’assassino modo idiota. pazzo, solo l’ennesimo imbecille spero diano carcere vita, grande sospetto, fra decina anni, uscirà carcere laurea giurisprudenza similari",2023-11-20,anger
"problema viene considerato “folle”, rischia ridurre responsabilità, giustificandone addirittura l’operato. ragazzo pazzo piuttosto criminale. dietro all’assassinio ragazza piano studiato tempo ben consapevole.",2023-11-20,anger
"sento assolutamente rappresentato cazzate fantabiologia. umani, auspicabilmente, grado esercitare sano autocontrollo.",2023-11-20,anger
adesso però dopo aver sentito spiegazione presunta società patriarcale ripetete pappagallo concetto fondamento.,2023-11-20,anger
vedi proprio problema :) continui mettere te stesso prima dell’esigenza richiesta aiuto grosso gruppo persone. devi ascoltare,2023-11-20,sadness
">perché devi metterti centro tu? fare distinguo? probabilmente perchè essere lombrosianamente etichettati continuazione potenziali assassini/stupratori ogni volta succede fatto simile metterebbe chiunque difensiva, butto lì eh.",2023-11-20,anger
"ribadisci contesto donne appena gridato stanche essere uccise. devi metterti centro tu? fare distinguo? ascoltiamole, sappiamo uomini decenti, no? cerchiamo capire dolore. solo pazze? ah",2023-11-20,anger
"d'accordo colpevole merita condanna piena, piano stato studiato, sicuramente stato ritrovato germania, malconcio, bordo strada senza benzina senza soldi. e' chiaro persona meno intelligente pianeta stato gesto preterintenzionale, purtroppo scaricato corpo fretta durante fuga fuga conclusa modo. gente vedeva omicida sangue freddo secondo me visto troppi film serie tv.",2023-11-20,anger
"difatti scelta migliore, ragazzo 20 anni plus nell'avere rapporti relazionali ragazza giusto capire?",2023-11-20,joy
"fatto tasso basso altri paesi vuol dire accettabile. d'accordo fatto ovviamente uomini possono subire violenza, vuol dire esista problema culturale importante affrontare. va smantellata cultura tossica possesso, violenze psicologiche fisiche vengono goistificate ""lo fa perchè innamorato/a!"" poi però piangiamo quando vittima questione viene ammazzata sfregiata l'acido.",2023-11-20,anger
"principalmente uomini uccidere, basta. ovvio poi ogni statistica confermi tendenza.",2023-11-20,anger
"dati vanno contestualizzati, esempio secondo ricerche donne violenza psicologica, mentre uomini fisica, motivo molto banale, semplicemente l'uomo molto forte fisicamente donne, quando mondo iniziato esistere forte esercitare maggior parte violenza, senso punti vista evoluti donna fisicamente aggressiva, può dire questione morale, potrebbe semplicemente essere mancanza opportunità. problema fenomeno mediatico eccessivo, vogliamo no uguaglianza? statisticamente mette risalto molto accade donna. fenomeno reale statisticamente trascurabile, c'è muore ucciso fulmine, cade vaso testa. tasso omicidi italia bassissimo, femminicidi ancora molto basso, c'è probabilità nascere alti, belli ricchi venire uccisi femminicidio italia. dire italia ogni anno 20 persone muoiono folgorate fulmine, 1/5 donne uccise femminicidio, vedo nessuno preoccupi quinto venire folgorato fulmine quando piove rispetto paura donne internet venire uccise proprio fidanzato.",2023-11-20,fear
"nessuna violenza ca sminuita, però mettiamoci fette prosciutto davanti occhi: principalmete uomini uccidere donne ambiti relazionali. c'è problema culturale sociale affrontare, giriamo intorno.",2023-11-20,anger
"resta fatto tagliare fondi scuole é coerente. chiudo qui ""questione politica"" voglio proprio metterla mezzo.",2023-11-20,anger
"tecnicamente parlando, governo già approvato [un piano femminicidi:](https://www.fanpage.it/politica/il-governo-approva-il-nuovo-piano-contro-la-violenza-sulle-donne-cosa-prevede-e-quali-sono-le-novita/) conosca bene, probabilmente c'era dentro solo roba inutile, peraltro ancora stato concretizzato, però onore cronaca sembrava giusto dirlo.",2023-11-20,anger
"fregasse davvero, aspetterebbero nuovo caso mediatico ""risolvere"" problema. successo incidenti stradali, stupri ora questo.",2023-11-20,anger
">dimostratelo soprattutto educando rispetto giovani. qualcuno dimostra atteggiamenti violenti bisogna glielo notare, l’educazione viene solo famiglia, sopratutto frequentazioni",2023-11-20,anger
sti ragazzetti social ormai han perso testa ogni tipo personalità cinici finti redpillati suffragette tempo perso ormai ogni cosa mondo b social ragazzetti vanno dietro senza pensare.,2023-11-20,anger
?,2023-11-20,fear
maschi stati discorso fino ora,2023-11-20,joy
direi op vittima stesso società patriarcale riesce dare giusto peso ciò successo. due domande,2023-11-20,sadness
"c’è studi scientifici indicano l’uomo aggressivo natura, chiamarsi testosterone. comportamento umano, grazie cielo, dettato fortissima componente culturale, resterà sempre tendenza fondo evidenzierà sproporzione criminali violenti lato uomini, proprio predisposizione naturale. ora, fare campagne sensibilizzazione va benissimo, bisogna comprendere eliminerà mai problema femminicidio però tutto, probabilmente resterebbe sempre limite insuperabile statisticamente parlando persone ucciderebbero donne.",2023-11-20,anger
"cosa esclude l'altra. assassino, stato piuttosto idiota.",2023-11-20,anger
"prova usare percentuali guarda numeri reali, stati 50 (circa) femminicidi italia quest' anno, rendi conto basso numero metti confronto ragazze relazione? problema statisticamente parlando 0,0001%, dunque casi isolati causati gente problematica. poi sminuire fatto uomini generale vengono uccisi quasi doppio rispetto donna? solo vengono uccisi partner? slogan ormai passare tv ""no violenza donne"" veramente preoccupante secondo me, statisticamente l'uomo viene probabile venga ucciso eppure bisogna solo dire no violenza donne. dire ""no violenza"", troppo neutro slogan? dato veramente problematico appunto suicidi, chiede quasi totalità commessi uomini? ce chiede tanto salute dell' uomo interessa nessuno. pure riguarda morti bianche, muore donna ogni 12/13 uomini, eppure tragedia solo quando muore donna. capisci voglio arrivare? vita donna valesse molto rispetto uomo.",2023-11-20,fear
"penso discorso manchi punto - c’è (a conoscenza) nessuno studio colleghi suicidi maschili donne, francamente dubito riuscirei trovare studi dicano depressione suicidio possano essere causati persona, piuttosto mix fattori. c’è invece l’evidenza che, quando donna viene uccisa, stragrande maggioranza mano uomo - statistiche pare dicano dell’ottanta cento viene ammazzata uomini sfera affettiva, circa cinquanta percento partner ex partner. prendiamo dati istat 2021: omicidi, maggior parte vittime state uomini, 39,3 percento donne. 58% donne state uccise partner ex partner, mentre stesso può dire solo 4,2%. parliamo uomini statistiche riguardante partner, ex partner così minuta essere quasi invisibile grafico. guardando numeri, forse prima conoscevi (ed normale, giornali tanta comunicazione sensazionalistica evitando abilmente parlare problema sistemico) riesci essere d’accordo fatto violenza partner ex partner problema prevalentemente uomini dover lavorare? tengo dire sempre s favore qualsiasi iniziativa sganci uomini pressioni patriarcali - maschilismo fa male loro, propone range molto limitato modelli rifarsi, molti quali tossici, uomini possono decidere adeguarsi rischiare l’esclusione. penso fare educazione sessuale sentimentale scuola possa aiutare molto tutt3 quant3.",2023-11-20,fear
"pourparler, mettiamo impressione riscontro statistico. spiegheresti atteggiamenti abusanti escalation violenza fisica omicidio uomini, donne?",2023-11-20,anger
">per domanda vorrei porre questa: ritenete controllare cellulare donna, limitare può vedere cosa può fare, urlarle faccia, decidere futuro normale cosa curiosa rendi conto comportamenti equamente diffusi donne. poi parliamo violenza fisica altro conto, proprio espresso tutta serie comportamenti atteggiamenti diffusissimi donne (in base esperienza, qua entriamo campo soggettività, presenti donne uomini)",2023-11-20,anger
"quindi numeri statistiche vanno guardate solo quando comodo tesi piuttosto un’altra? ovvio femminicidio manifestazione estrema dicendo, bisogna veramente tapparsi occhi sapere, 2023, esempio donna tre dice aver subito violenza fisica sessuale vita. poi morti bianche maschili stati casi mediatici me vengono mente varie, lì semmai fare notizia l’effetto shock morti giovani (così femminicidi). veramente scoraggiante cercare gettare luce problema culturale sentirsi rispondere “eh però uomini”. preoccupano problemi vittime prevalentemente uomini (tipo morti bianche) crea spazi appositi discuterne, prima venire darti supporto, votare promuove leggi sicurezza lavoro ferree stringermi cordoglio vittime innocenti problema. estendi stessa gentilezza donne dicono favore, cambiamo cultura così sempre meno abusate, picchiate ammazzate compagni?",2023-11-20,anger
completamente d’accordo.,2023-11-20,joy
"rendi conto letteralmente problema contratio esiste? uomini vengono ammazzatti italiana donne donne? domne ex, compagne mogli? punto dici proprio totale incapacità emotiva molti uomini (sono uomo, comunque). semplice, bisogna ascoltare. parlare, tanto, fra uomini. senti ragazza dire stufa uomini atai lamentando “no”, not man, preoccupato ego successo. son rimasto veramente terra, pensavo nuove generazioni diverse, coscienti",2023-11-20,anger
"ragazzi cose ragazze egual misura, fate finta angioletti fate identiche cose, magari tralasciando scontro fisico (non sempre eh, succede proprio ragazza magari sberle ecc) andando psicologico, cui, sa come, parla mai. dati parlano chiaro 77% suicidi italia parte uomini. discorso capisco, uomini devono migliorare gestire emozioni, rabbia ecc prego fare finta donne tanto meglio, fine uguali, umani.",2023-11-20,anger
"qua parla femminicidio maschile tossico ecc ecc, qua parla svitato assassino, punto. uomo, alieno vuoi svitato, essere umano indipendentemente sesso, può concepire idee simili guidato pazzia/problemi gravi. quindi, tutte persone dicono ""tutti uomini"" oppure ""insegnate figli uccidere"" dimostrano solamente iq livelli rasoterra, nient'altro. poi porca paletta morta ragazza, lasciatela riposare pace, strumentalizzatela frasi cazzo.",2023-11-20,anger
comunque l’omicidio genere un’invenzione giornali.,2023-11-20,anger
"allora ripeto. appunto, “not men men potrebbero usare situazioni genere capire cosa c’è va” trovi d’accordo, però fare serve coalizzarsi uomini donne. insegnare funzionano relazioni, insegnare gestire elaborare emozioni, insegnare rispetto altri, insegnare individuare comportamenti pericolosi/ red flags, chiedere aiuto allontanarsi. invece fare cade solite inutili discussioni ( facendo). ovviamente (e fortunatamente) omicidio considerato deplorevole tutti, uomini donne. d’accordo doveva succedere d’accordo dovrebbero succedere altri. stessa parte. però poi arrivano post generalizzazioni ecco creati due schieramenti litigano puttanate quando problema base persiste. qui finisce piccolo rant, semplicemente sopporto vedere sempre solite discussioni litigate partire genere tragedie invece “utilizzarle” discussioni sensate utili",2023-11-20,anger
"“io uomo già torto” no. uomo dovresti chiederti “ma forse modo educato mascolinità ruolo ruolo relazioni sbagliato? cosa pensano donne intorno me? quali esperienze genere maschile?” assicuro 50% grado raccontarti episodi veramente sgradevoli dovrebbe riflettere. not men, men possono usare situazioni genere capire cosa c’è va",2023-11-20,fear
"semplice, d’accordissimo cultura relazioni tossiche, d’accordissimo può educare fare evitare situazioni, pronto dialogo cercare eventuali soluzioni esordisci yesallmen ogni dialogo simili già impossibile. uomo già torto. discussione genere può servire qualcosa? generalizzazioni genere indipendentemente contesto sempre solo controproducenti. insegniamo guardare cose modo oggettivo, ragionare dati titoli giornale. no finirà sempre due schieramenti invece trovare terreno comune scannano puttanate generalizzazioni ignorando vero problema.",2023-11-20,anger
"amen. pena “non uomini” “non mica responsabilità educare persone?” no, è, però sapete benissimo storie genere sentono fin troppe italia, invece riflettere fatto che, forse, significa ragazzi (e ragazze) italia vengono educati approcciare relazioni modo tossico, fate finta niente",2023-11-20,anger
"direi siam rotti p***e sentirci dire “non colpa dell’assassino, colpa uomini”, “è colpa società patriarcale”, “è colpa cultura stupro”. ormai ogni notizia fa riferimento questo. vogliono deumanizzare figura dell’uomo genere costi, perora ciò vende. nessuno vede 99% uomini ciò sono! lavoratori badano proprie famiglie, danno tetto futuro cari, mettono salute altrui prima loro. vedono solo singolo psicopatico assassino, stupratore frustrato l’ubriacone picchia moglie.",2023-11-20,anger
dico dire ripete colpa uomini qualcuno impazzisce solo l'effetto opposto desiderato. perchè tanta gente giustamente incazza. parlare 2023 società patriarcale stupro ridicolo,2023-11-20,anger
bipede medio vuole storie genere sfogare emozioni compresse società disumanizzante così vendono date storie far parlare posto problemi paese classe opprimente gradisce discussi.,2023-11-20,anger
https://preview.redd.it/zz4hpta6tf1c1.jpeg?width=1080&format=pjpg&auto=webp&s=226f45ed422d8cf02e0aa6891020b51be5ffce33,2023-11-20,joy
"però snocciola fino fondo dati. 324 omicidi 60m abitanti, fa 0.005% persone uccise ogni anno. queste, buona parte maschi, quindi 127 femmine. conseguentemente 0.002% femmine uccise. queste, 69 state uccise ex, quindi 0.001. &#x200b; saprei, 0.001% sembra leggermente poco essere considerato ''rischio concreto rischiare vita''",2023-11-20,fear
