Comment,Date,Emotion
"ben vengano provvedimenti, paura venga puntato dito verso uomini basta. comprendo rabbia sorella giulia, morta mano uomo, fatto innegabile. comunque vai vedere storie sorella puoi notare condanni uomini, intervengono, me follia. senso, [non prendo mazzate salvare donna conosco perchè s'è messa maltratta.](https://www.corriereadriatico.it/attualita/picchiato_difende_fidanzata_milano_francesco_oggi_20_11_2023-7768080.html) infine, due relazioni tossiche, un'alcolizzata caso disturbi alimentari depressivi, stato molestato università collega interagito sì no 2 volte. eppure urlo mondo l'odio donne, nè dico tutte donne disgustose, perchè, eccezion fatta molestia, due relazioni comunque stato santo, perchè litiga sempre due, nonostante mai iniziato nulla (mai alzato mani nessuno, fronte torti gravi subiti partivo quarta, ripromesso incontro persone genere allontano basta, alimento tossicità). nego l'esistenza problema, chiedo uomo intervento equo uomini donne, purchè capiscano genere umano fallace azioni sbagliate compia genere, migliorare insieme.",2023-11-21,anger
"l'omertà fenomeno diffuso entrambi sessi, senza scomodare patriarcato ce fa fare farci cavoli nostri, bel premio fine, parti inverse vedo tutta bontà d'animo e/o eroismo donne, anzi vedo parte nessuno. poi quando amico esagera sbaglia fa notare comunque.",2023-11-21,anger
"legittimo 100% me. libertà c'è c'è punto vista, compito società educare reprimere dogmi",2023-11-21,anger
"quindi legittimo essere omofobi razzisti, secondo ragionamento. secondo me situazione sfuggendo mano",2023-11-21,anger
"pensiero ognuno libero, l'odio verso 'altra persona, ancora peggio ""categoria persone"", tendenzialmente sbagliato può portare tempo azioni limitano pensiero, ergo discriminazione. hitler salito potere gente culo ebrei. salvini meloni raccattano parte voti certa gente culo ""non italiani pvrosangve"". persona può innocentemente fare privato, sicuramente diritto carità, può tradurre tempo generalizzazioni. tornando discorso ""maschi cattivi"", tante persone dicono ""maschi cattivi"" tempo nasceranno movimenti politici diranno ""maschi cattivi"" sanno c'è sufficiente numero fessi italia voterebbe. poi boh, legge anti cazzo, so. soldoni, usare parola odio sproposito favore, termine forte. massimo qualcosa tipo ""mi culo pakistani pizza mettono paprika pomodoro"" (realmente successo).",2023-11-21,anger
dall'odio nate lotte belle (e brutte),2023-11-21,anger
"c'è omertà mondo maschile. c'è omertà generale tutto. forse paura passare ""cagacazzo""? forse svogliatezza? so, onestamente credo vedere omertà ovunque, solo rapporti uomini vs donne",2023-11-21,anger
"bisogna votare destra possibile, l'unica salvezza razza",2023-11-21,anger
forse? sicuramente,2023-11-21,joy
"giustamente conti fatto nascite continueranno diminuire, sempre remare raccomando 💘",2023-11-21,anger
verità maggior parte omicidi donne commessi ultrasessantenni.,2023-11-21,anger
adoro 💘,2023-11-21,joy
sì.,2023-11-21,sadness
senza s,2023-11-21,fear
"dio cristo menomale governo estrema destra, pensa puttanate tirato fuori governo c'era sinistra ragà ricordatevi votare, importante, importa chi. ora venite pure fare via crucis downvote anmirate stupiti me frega 🗿",2023-11-21,anger
"diritto, posso odiare pare male concreto posso farlo. assurdo pensare possa odiare x paese definito libero.",2023-11-21,anger
"credo intenda odiare temere sentimenti possono reprimere. dire diritto boutanade adolescenziale, implica dovrebbe essere tutelato apposite leggi concordati internazionali conseguenze equilibri società sana fa molta fatica immaginare.",2023-11-21,anger
"""forse solo minima parte""",2023-11-21,sadness
"problema social purtroppo l'assoluta sicurezza parte gente verrà detto conseguenze legali, perciò scrivono peggiori bestialità passano testa. vivo nessuno verrebbe te insultandoti pensiero, sa beccherebbe pugno denuncia, conseguenze legali post scritti social severe forse ambienti civili.",2023-11-21,anger
quindi spari,2023-11-21,anger
sparare ritengo esagerato prima poi [succederà panama](https://www.youtube.com/watch?v=filpziqhx0k),2023-11-21,anger
"rotto scatole pagare tasse danni causati vandalismo, poi capisco zecche nullafacenti te problema",2023-11-21,anger
top 10 persone normali,2023-11-21,anger
"bene, sti attivisti ultima generazione rotto ecoterrorismo",2023-11-21,anger
"social ambienti sociali tossici, me detto pure psicologa (che proposito scelto deliberatamente donna), risposto stato fortunato crescere nell' ambiente pre-internet conoscere differenza, piango nuove generazioni iniziato socializzare direttamente merda internet... (lei mezzo sospirato)",2023-11-21,sadness
guardati intorno. gente dice ammazzerebbe qualcuno pistolettate bloccano strada,2023-11-21,anger
"no. ogni volta accade tragedia, ""...s'indigna s'impegna poi getta spugna gran dignità..."". accadrà qualcos'altro ritroveremo nuovo stessa situazione. no, pessimismo ciclo (di rotto palle).",2023-11-21,anger
"beh evidentemente problema, scale misura differenti, 660 000 morti l'anno solo 100 femminicidi, scopo diminuire mortalità allora focalizzarsi così tanto femminicidi tentare spegnere incendio propria saliva, invece discriminare dare un'importanza maggiore fenomeno minore allora si, bene...",2023-11-21,anger
"ecco vedi, conti 660mila morti l'anno? senso fare confronto femminicidi auto finisce fosso? risposta: no. senso. senso fare confronto femminicidi omicidi altri ambiti.",2023-11-21,anger
"parliamo [statistica](https://www.openpolis.it/resta-alto-il-numero-di-femminicidi-in-italia-e-in-europa/) allora: 2022, 61 delitti vittima donna 125 (successi nell'arco dell'anno) partner ex partner. cioè, circa 50% omicidi riconducibile femminicidio. me pare statistica poco conto. evidentemente usiamo scale misura differenti. pace.",2023-11-21,anger
"comprendi dici discriminazione? combattere discriminazione altra discriminazione? massimo puoi ottenere fomentare odio, altro sensibilizzazione. finché riesce capire vedrai gente palle piene, altro sensibilizzazione, responsabilizzazione, ecc.",2023-11-21,anger
l’unica cosa rotto palle ridicolo attivismo social puntualmente avviene ogni tragedia. edit: giornalisti merda intervistano parenti vittime lacrime. iene merda.,2023-11-21,anger
"stessa cosa senso paragonare due cose? ironizzato fatto. femminicidio riguarda l'ambito giuridico dovrebbe riguardare meno persone parlano agiscono panza l'emotività. comunque parlava paura. nessuno paura fulmini, incidenti stradali femmicidio nonostante fenomeno statistico poco conto.",2023-11-21,fear
"scritto stessa cosa? bisogna capire caso crea paura morire spropositata l'altro no. incidenti stradali, creano sacco vittime ogni anno diverse donne problemi bere po' oppure usare telefono guida.",2023-11-21,fear
"paragonando. sai, paragonano na sega fare l'uno l'altro. proprio tieni, prevenzione fulmini materia tecnica va affidata specialisti (ingegneri ecc). femminicidio cosa invece riguarda collettività. troppo difficile",2023-11-21,anger
"ah si, ammazzare donna lasciato proteggersi fulmine, proprio stessa cosa",2023-11-21,anger
vorrei dirlo amico moglie minacciava fargli vedere figlie purtroppo é anni ammazzato,2023-11-21,anger
"certo, l'oggettivo privilegio maschile. certo. aspetta vado dirlo all'amico neo divorziato ex moglie nuovo compagno vivono casa mentre affitto. effettivamente prime cose detto proprio sentirsi empowered bilanciare privilegio maschile generazionale.",2023-11-21,anger
"alcune battute però ridere, mentre ricordo nessun/a femminista fatto ridere, quel ricordo medie superiori ricordo ragazze ridere e/o premiare comportamenti bullismo, niente fare patriarcato fare psicologia umana. poi nesso causale battute omicidi molto difficile provare, correlazione bassissima, buona parte omicidi vengono prevenuti evitati benessere sistema giudiziario, mancanza battute.",2023-11-21,anger
"> stragrande maggioranza uomini gode stato privilegio > molti uomini seme sessismo purtroppo c'è. dati istat immagino? argomentazioni basano cazzate trite ritrite vengono vomitate spruzzo ogni volta discute l'argomento, potevi risparmiarti wall of text. pare sognare, te fa ste affermazioni ombrello sesso maschile sembrate veramente stregua terrapiattisti crede scie chimiche.",2023-11-21,anger
"morti folgorazione fulmine 20 mediamente ogni anno circa quinto femminicidi quest'anno, eppure l'attenzione verso folgorazione fulmine riceve quinto paura dell'attenzione prevenzione. statistica insignificante femminicidi, donna ogni tre giorni, serve genio matematica capire quando muoiono 660 000 persone ogni anno italia, 100 numero completamente insignificante allarmante confronto.",2023-11-21,fear
"grandi privilegi maschili ricordiamo: \-maggior parte suicidi \-stragrande maggioranza senzatetto \-morti lavoro \-tribunali permettono ex mogli rovinare vita ex mariti, farsi mantenere vita costo mandarli lastrico spesso senza permettere padri vedere figli \-farsi rovinare vita false accuse violenza totale assenza prove, credendo qualsiasi donna accusi uomo \-essere diffamati discriminati chiunque senza conseguenze (esiste libro chiamato ""odio uomini"", esistono studi genere letteralmente estratto mein kanpf parola ""uomo"" posto parola ""ebrei"" vengono presi serio \-vengono uccisi, derubati picchiati piu uomini donne nessuno parla perchè cosa fa notizia può essere strumentalizzata capricci ragazzine viziate piagnucolano patriarcato altre stronzate",2023-11-21,anger
"fra, manco caso. qi azzerato troppo poter fare discorsi normali femministe oggi. parte penso, vuoi, pensa possa ucciderti momento all'altro solo maschio basta levi palle almeno.",2023-11-21,anger
"va avanti così domani domani dopo, risposta si, fortuna vita rompe balle maniera autonoma inestinguibile xd",2023-11-21,anger
"veramente vedo post femminismo altro, post infiniti uomini fragili dicono patriarcato un'invenzione. comunque no sento tirato causa",2023-11-21,anger
ancora volta maschioni lupialphaleoninellasavanacazzoduroaoltranza mettono frignare appena vengono messi discussione ![gif](emote|free_emotes_pack|grin),2023-11-21,anger
spero tutte. altrimenti morte sociale. ah no aspetta.. possiamo ancora approcciare tinder instagram,2023-11-21,anger
"ok, cosí. pensi donne escano casa sogno l‘obiettivo essere avviccinate sconosciuti, sbagli.",2023-11-21,sadness
"bene... ragazzi vergini oggi potranno dire addio mera possibilità trovarsi compagna. stato attuale, semplice approccio sociale/naturale passare orchi. forse caso allora donne cercarvi l'uomo piu noi. dato patriarcato voluto no? sicuro stato patriarcato",2023-11-21,sadness
"onestamente no. invece rotto balle titoli giornale quasi apologetici tipo assassini. narrazione crea sottotesto inconscio potrebbe far sentire giustificato agire prossimo deficiente instabile saprà sopportare no motivo. dopo settimana cordoglio scorderanno fino statistiche mano c.d. ""femminicidi"" sola fattispecie omicidio accenna diminuire italia. invece sentirci offesi proviamo capire attimo diventare parte soluzione insegnare emotività sana fin giovani.",2023-11-21,anger
"tratta qualche matto problemi mentali problema culturale. essere sincero fastidio, coscienza posto.",2023-11-21,anger
"adesso sapete sentite ragazze sub ultimi mesetti post donne...semi scherzi parte.. anch'io scocciata po' post così, parlarne esporre potenzialità esistono, possiamo certo generalizzare intero genere, possiamo essere attenti cercare attivarci subito quando vediamo brutti segni futuro",2023-11-21,sadness
"tanto tempo fa, supporto supporterò mai attivamente causa femminista ogni derivazione",2023-11-21,sadness
"qua po' esagerando accuse sa. puoi considerare uomo maschilista solo perchè ride battuta donne. rido battute qualsiasi argomento, fatta bene, ben studiata ottima punch line viene naturale. cosa posso controllare. rido battute black humor, quindi secondo ragionamento pedofilo, razzista, sessista ecc ecc? rido battute donne, vita quotidiana rispetto, incontro strada fischio dietro, amica vado molestare, ex rispettato scelta concludere relazione. problemi sono, altri, parlando battute sessiste ridicolizzando po' problema sicuramente aiuti causa.",2023-11-21,anger
"temo degenerazione totale porti paragonare donne categorie protette. esempio: battibecco qualcuno/a prendete male parole, parte porge querela diffamazione: - uomo ""il fatto sussiste"" - donna ""azione gravissima, condannato""",2023-11-21,anger
"ah beh certo, aspettava solo sorella morisse approfittarne, vedeva l'ora poter fare femminista cattivissima tivvu ragazza. rendi conto cosa cazzo dici? livello sottozero empatia hai? essere esattamente problema, sicuramente ammazzerai nessuno pronto disumanizzare dolore vissuto ragazza solo senti preso causa?",2023-11-21,anger
"pugno spaventare porti omicidi ripercussioni gravi bisogna vederlo. fate benissimo parlarne discutere dell'accaduto, farne casi mediatici altro conto",2023-11-21,anger
"già violenza, va evitata. poi tipo violenza sfoci omicidio 1/10 1/100 discorso seguente, già problema succeda questo. violenza confronti genitore presenza figlio minore, inoltre, violenza confronti figlio minore. bambina stata male settimane. bisogna parlare fenomeno intero media amico possano farsi esame coscienza prevenire, violenza attuale possibile violenza futura.",2023-11-21,fear
">devi sentirti proprio grande uomo prendere giro sminuire sorella stata ammazzata evidenziato problema sociale presente italia. rispetto sorella grande coraggio comprendo dolore. tuttavia, momento decidi esporti pubblicamente diventi personaggio pubblico parole soggetto critica. condivido assolutamente tentativo sorella dipingere ogni uomo potenziale violento omicida, nè scaricare tutta colpa patriarcato ricordo anni esiste più.",2023-11-21,anger
"senso, dov'è discriminazione?",2023-11-21,anger
"possiamo parlare uomini chiedere interrogarsi modo vedono donne, fatto molti già attivamente violenti cattivi, potrebbero finire essere violenti compagne perdere controllo. amico recente durante lite orribile moglie tirato pugno cartongesso, 50cm moglie, davanti figlia 3 anni. mano rotta, figlia terrorizzata, moglie sull'orlo divorzio. shockato reso conto averlo fatto far paura moglie sperando farla stare zitta. mai pensato essere tipo fare cosa genere, invece è. tanti altri. possibili violenti prendessero coscienza, adoperassero pensare evitarlo, lungo andare meno vittime. tipo amico reso conto prima arrabbiato poteva andare farsi giro calmarsi. fulmine ragionamenti posso fare.",2023-11-21,fear
"fulmini posso fare poco, posizionare para fulmini massimo, posso parlare. fulmini detto amarci volerci far stare bene star bene noi. credo paragonabile.",2023-11-21,joy
beh fulmini puoi fare diverse cose. punto. comunque femminicidio puoi fare tanto? magari senza discriminare stesso tempo mentre qualcosa riguardo?,2023-11-21,anger
"discorsi, fulmine uccide indiscriminatamente. protesta morte chiamalo pare apice atto estremo cultura volta svilimento mortificazione genere femminile. l'atto femminicidio estremamente raro, assolutamente comprensibile dire basta gran voce tutta serie comportamenti forza fisicamente violenti. ovvio uomini serve dirlo... riprendendo commenti stesso posto, punto responsabilizzare piu genere maschile fare quei micro comportamenti viscido allucinante stesso maschio sento estremamente disagio vergogna quando sento vedo qualcun'altro fare catcalling",2023-11-21,anger
"ragazzi, ogni tanto arriverebbe momento fare mea culpa. dopo anni terrorismo psicologico femmincidi l’unica cosa sappiamo dire é “ah beh mai!”, allora cambierà mai niente penso neanche filippo pensasse essere grado fare gesto così insano, eppure eccoci qua. comunque ricordiamoci femmincidio succede ambiente asettico, bolla vuoto, avviene società immersa patriarcato; ogni volta amico fa catcalling fermiamo, ogni volta mangiamo ragazza occhi partendo puntualmente seno, ogni volta nell’immensità fine umorismo rispondiamo “women ☕️” qualsiasi opinione espressa donna, ogni volta qualche motivo ingiusti atteggiamo aria presunta superiorità scriviamo post all’alba dell’ennesima tragedia l’unica cosa sappiamo dire eh “non uomini “, alimenta società porta creazione persone tragedie filippo giulia. quindi cortesia prima fare vittime cazzo, volta proviamo avere dell’empatia capiamo dicono certe cose vere vittime",2023-11-21,anger
"allora, donna moderatamente femminista vorrei provare chiarire alcune cose. premetto parlo nome genere femminile. 1. momento caldo, appena successo fatto cronaca acceso animi, quindi persone tendono parlare pancia. quando sbarcano migranti quando c'è attentato roba genere, dà voce sentimenti dentro generalmente sopiti. prego avere rispetto sentimenti 2. ce l'abbiamo te uomini. cercando scalzare sistema valori ottimale produce alcune storture. dobbiamo farlo forza insieme, maschi femmine, forza cose gran parte dell'azione azione mani maschi sensibili verso tematiche. purtroppo significa maschio chiedendo rinunciare qualcosa. avere paura, piccole rinunce, tipo fare certi commenti alimentare certa cultura maschilismo tossico già probabilmente contrario, cambio società migliore. serio, puoi prendere giro femminismo certi eccessi, pensi calma movimento unico storia modo pacifico ottenuto conquiste incredibili. scommetto contento conquiste. state ottenute uomini donne tutta società unita. 3. concentriamo problemi vittime ignoriamo resto. so questioni riguardano maniera statisticamente rilevante maschi. giorno organizzi manifestazione qualche tematica maschi vittime vengo, società deve essere giusta tutti.",2023-11-21,fear
respira meno segati piú,2023-11-21,anger
parla meno respira piú,2023-11-21,fear
"sì punto pure donne potrebbero essere colossali idiote, molte sono. poi va toccare no linea dell'omicidio c'entra genere bensì stato mentale. andiamo criticare solo genere fra due femminismo va cagare",2023-11-21,anger
no? ego così fragile,2023-11-21,sadness
"sembra assurdo allucinante generalizzazione maschio=male. guarda solo quell'esaurito piero pelù, giusto prenderme caso, ”vergogna essere uomo rifare"". folle generalizzazione colpevolizzazione genere.",2023-11-21,anger
"quando partono deliri collettivi, l’indifferenza cosa migliore. numeri parlano chiaro, paese meno femminicidi europa trend discendente. gente inizia spegnere cervello dare aria bocca, costretti farlo noi. abbassiamoci livello, gioco.",2023-11-21,anger
"100 femminicidi quest'anno paura? morti causate fulmini 20, diresti c'è 1/5 paura venire folgorati fulmine giro? paura casi così sporadici bisogna altro farsi domande significato propria paura",2023-11-21,fear
"veramente quando vedo fare 2000 post succede cosa, sorrido pensando fra settimana già scordate",2023-11-21,joy
"chiamo ""effetto chihuahua"" così piccoli indifesi temono qualsiasi cosa ringhiano dubbio 😅 credo paura generalizzata derivi fatto sappiamo essere gazzelle savana. sappiamo essere facili vittime. forza fisica necessaria contrastarvi. qualsiasi uomo potenziale predatore punto bianco decide farci male. pratica viviamo costante paranoia cosa bella neanche noi. fidandoci, volte proprio così cadiamo trappola, pensiamo ""lui mai male"". letta modo, donne generale, fidarsi uomo significa letteralmente affidare propria vita lui. poi cresciamo frasi tipo ""non stare mai sola"", cioè rimanere ""branco"", vestirsi certo modo ""dare nell'occhio"", manco appunto branco prede savana predatori. quindi cresciamo consapevolezza può accaderci tutto. invece viene detto rispettarci farci male potenziali assassini, stupratori. violenti generale. cose danno fastidio entrambi fronti. situazione ricorda molto l'anime visto beastars.",2023-11-21,fear
"no, vedo post me. bisogna mancare proprio punto farne questione personale.",2023-11-21,anger
"no, bestie.",2023-11-21,anger
cazzo me frega me,2023-11-21,anger
"secondo me fronte 105 donne uccise uomini 0 (credo) uomini uccisi donne prima cosa gridare not men uccidere motivo vanto significa parte problema. dico maschio. femminicidi (ma stupri, casi violenza domestica ecc.). casi isolati correlati nessuna cultura patriarcale così tanta diversificazione vittime donne vittime uomini, sembra concetto tanto difficile capire. dicendo uomo viene stuprato merita meno attenzioni donna viene stuprata assassini persone sane mente tutta colpa maschi riconoscerlo significa far parte cultura gravità diverse. so capisce scritto",2023-11-21,anger
"no, gente diritto dire opinioni condivisibili, stesso tempo diritto criticarle. post ultimi giorni verità bugie, spetta confutare ultime.",2023-11-21,anger
"no, frega cazzo paio rincoglioniti internet.",2023-11-21,anger
"punto uomini veniamo educati secondo patriarcato fatto dia fastidio l' ""all men"" significa chiamati causa. soprattutto fatto aver ucciso/maltrattato nessuno proprio vanto strano, briciolo empatia dovremmo mostrarlo noi.",2023-11-21,anger
madonna ego fragile,2023-11-21,anger
"ieri visto pubblicità rai violenza maschile donne. me infastidisce questo, dovrebbe dover specificare sesso. secondo me pubblicità dovrebbero essere violenza basta, esiste unicamente violenza uomini, probabilmente comune. sembra solo uomini capaci compiere azioni simili, quando realtà donne capaci fare stesso.",2023-11-21,fear
"dottor cruciani l'ha detta giusta ""io sento colpevole""",2023-11-21,anger
"“non ucciso ucciderò mai ragazza, nessun motivo farlo dopotutto” cioè ragazza desse motivo, faresti. ok. invece dire “non etico // giusto // pensiero folli”, dici “non nessun motivo farlo”. forse, dico forse, cerca essere empatico (o qualsiasi altra cosa possa servire sparare frasi genere).",2023-11-21,anger
"vorrei capire cosa. uomo fa roba genere uomini vengono visti bestie dormienti pronte azzannare donne. donna fa cosa simile uomo, silenzio stampa?",2023-11-21,anger
"venisse detto me roba simile, tiro fuori ca22o sego",2023-11-21,anger
"anni stancato essere messo stesso livello assassino stupratore, donna stuprata uccisa responsabilità, responsabilità penale individuale, spiace femminicidi omicidi generale, me sento responsabile, così sento pedofilo, nonostante molti episodi pedofilia carnefici uomini",2023-11-21,anger
"capisco sentiti presi causa. qualcuno detto op ammazzerà sicuramente prossima ragazza sta? no. parlare problema evidentemente affligge genere maschile tanto portarlo gesti estremi, sembra sinonimo generalizzare. invece, cogliendo palla balzo spostando l’attenzione violenza uomini (che nessuno nega esista… spesso fatta altri uomini, l’altro), sminuire problema. sminuire fregarsene parte problema ragazzi! stupisce veramente riusciate capire paura donne, alimentata sicuramente grande risonanza mediatica fatti, colpisce donne attorno! chiedendo partecipare fianco lotta ideologica azioni (leggasi dissociarsi comporta maschilista, riprenderlo, portarlo riflettere azioni possibili conseguenze ecc. già parte così, chiedendo farti saltare aria sotto palazzo chigi)",2023-11-21,fear
"donne be like: \> omg, netanyahu mostro ritenere palestinesi responsabili hamas \> #yessalmen, uomini responsabili l'omicidio giulia cecchettin",2023-11-21,anger
"altro perplesso fatto poco farsi sega pensando ragazza considerata molestia psichica distanza, parte capisco l'indignazione visti fatti gravi. poi alcune schizzate vorrebbero l'estinzionismo maschile un'altra storia.",2023-11-21,anger
"eh d'accordo, iniziassero media dare buon esempio.",2023-11-22,anger
quindi autorizzati commettere reati?,2023-11-22,anger
"basato principio interazione. fate tante interazioni qualcosa, viene reputato interessante, esaltato, creano altri contenuti via così. ognuno darà contributo vorrà fare piccolo lucro, economico sociale. settimana giulia fine dell'altra giulia, morta incinta. cioè verrà dimenticata fino prossima occasione.",2023-11-22,sadness
"nulla, dispiace. venti anni soffro ritardi mentali. basta semplicemente dare spazio gente idiota dice banalità violenze.",2023-11-22,anger
"""voi"" 2 giorni lamentate dice essere assassino solo perchè uomo.",2023-11-22,anger
"due giorni lamentate cretine, probabilmente usano cosa esclusivamente pubblicizzarsi.",2023-11-22,anger
"falso, scritto",2023-11-22,sadness
"""c'è post"". scrivi tu, necessariamente.",2023-11-22,joy
"no certo, estrapoli frase contesto no. aggiungi ""*ma ipocriti parti?*"" però chiaro modo soggetto.",2023-11-22,anger
"c'è niente twee roma nord sfigati, vedendo solo messaggi uomini devono frignà perchè qualcuno detto bubu cacca. zero post supposte femministe vogliono mangiarvi testicoli ballare tomba. uscite casa, parlate madre, sorella, amica. ascoltate invece sparare zero, brutti idioti, stata ammazzata na persona porca madonna, empatici bustina oki. vermi obbediscono solo quando arriva sbirrolo bastone, resto armadilli cacano mentre ritraggono stessi.",2023-11-22,anger
">zero post te elencati diversi, vuoi fare negazionismo invece prendere distanze approfitta tragedia istigare all'odio allora mostri sommato d'accordo estremiste.",2023-11-22,anger
"sembrate er caccola frigna commissione rai perchè 4 facebook scritto ""devi morì ammazzato"" ranucci detto nulla. però quando donna esce ogni sera dubbio stuprano meno sentirsi minacciate",2023-11-22,anger
"creato database segnalazioni anonime chiunque può ""denunciare"" chiunque. reato, fatto difenda agghiacciante.",2023-11-22,anger
"però condanni due misandriche, critichi imaledetti messaggi dici sotto attacco, quando così.",2023-11-22,anger
"mai detto ""tutte donne vogliono odiare uomini"" , evince tutta malafede quest'ultima frase.",2023-11-22,anger
