Comment,Date,Emotion
"caso articolo giornale parla coppia scomparsa nulla? risposta no, preso causa casistica questione.",2023-11-13,anger
eh...,2023-11-13,sadness
"e' spero ogni volta, premesse preoccupano. speriamo bene.",2023-11-13,fear
">ho lasciato ragazza 4 giorni fa, fatto alcun tipo violenza. così quel ""sempre"" stato neutralizzato scritto cosa? fumate? solo detto vicende, litigio, ex supera rottura, sparizione finisce sempre unico modo. mantengo briciolo speranza cosi, ragazza bene riporti casa. 22 anni, perdio. >perfavore modifica commento, oltre essere offensivo aiuta causa femminista dell'evitare violenza, crea solo divisioni odio. odio divisione vuoi, vero? causa femminista viene decisa uomini, permetti. sembra potremmo essere nuovo fronte all'ennesimo (e spero vivamente no) odio uomo verso donna. credo debba preoccupare contrario.",2023-11-13,anger
ahia,2023-11-13,sadness
> mentre fumava particolare degno nota.,2023-11-13,joy
>spesso spesso sempre? deciditi.,2023-11-13,sadness
"scritto: >donne, tutte pensando stessa cosa, vero? magone petto. finisce sempre unico modo. prima occhiata lascia intendere tutte storie, etero qui parla uomo donna, finiscono omicidio colpa dell'uomo. sappiamo gente legge velocemente senza approfondire, quindi facile creare malintesi.",2023-11-13,sadness
aggiungo cugino detto preoccupato l’ex superato rottura prima andarsene direzione cimitero l’ha strattonata braccio dentro l’auto,2023-11-13,fear
"bisogna avere paura donne: [giuseppe, sfregiato l'acido sara mastro: ""io, abbandonato tutti""](https://www.milanotoday.it/attualita/giuseppe-sfregiato-acido.html)",2023-11-13,fear
"ragione, son temere certi, troppi, uomini, l'etnia indifferente.",2023-11-13,fear
"tuti han paura necri estranei poi stragande maggioranza casi son parenti, ex partner.",2023-11-13,fear
caso donne purtroppo,2023-11-13,sadness
">infatti, ogni volta coppia lascia finisce omicidio. detto nemmeno questo, cosa confabuli caso? solo l'ex, pesantemente litigato, l'ha strattonata spingendola dentro l'auto partito. allora nulla. genere incontri spesso portano conclusione purtroppo. spero vivamente trovino viva!",2023-11-13,sadness
"direi due crimini diversi. punto vista dell'uomo ""innocuo"" due decisamente preoccupante.",2023-11-13,fear
"dio santo, oso immaginare genitori lei, sale un'ansia davvero terrorizza sol pensiero. so cazzo arrivare cose genere, so nasce, diventa sicuro qualcosa deve essere successo ragazzo, voglio credere normale. so solo provoca senso disgusto paura, sempre riferito ragazzo chiaramente (sempre supponendo caso peggiore base premesse sembra essere purtroppo).",2023-11-13,fear
amore tagliato fette,2023-11-13,anger
completo: uccide volta,2023-11-13,anger
"grandissima maggior parte casi cose finiscono ragazza trovata uccisa parte ex-fidanzato/fidanzato qualche famigliare. considera poi neanche fidanzati, ex (che superato rottura, dice cugino) oltretutto, citando news.... >**c'è stato litigio due:** vicino, mentre fumava, sentito grida giulia, strattonata auto filippo trattenuta all'interno, poi dileguato verso strada porta cimitero e' comunque troppo presto giudicare, auguro entrambi vivi salute tratti semplice 'fuga d'amore', sembra comunissimo caso omicidio.",2023-11-13,fear
"tiro caso, cerca convincerla tornare insieme, dice no, l'ammazza. prego dio aver sbagliato edit: ""un vicino, mentre fumava, sentito grida giulia, trattenuta macchina filippo, poi dileguato verso strada porta cimitero"" oh merda...",2023-11-13,anger
"donne, tutte pensando stessa cosa, vero? magone petto. finisce sempre unico modo.",2023-11-13,sadness
">finisce sempre unico modo. lasciato ragazza 4 giorni fa, fatto alcun tipo violenza. così quel ""sempre"" stato neutralizzato perfavore modifica commento, oltre essere offensivo aiuta causa femminista dell'evitare violenza, crea solo divisioni odio. odio divisione vuoi, vero?",2023-11-13,anger
e' leggere libro appena iniziato conoscendo già capitolo finale,2023-11-13,joy
fuga d’amore?,2023-11-13,joy
magari eccezioni. vorrei tanto io.,2023-11-14,joy
"no però detto ""non posso uscire te domiciliari"" ""nessun problema, vengo dartela io. poi dopo aver preso botte coraggio dirmi uomini stronzi. clown.",2023-11-14,anger
"posa fiasco, figliolo.",2023-11-14,anger
beh passa psicopatia. son eccezioni servono regola.,2023-11-14,anger
copa,2023-11-14,sadness
vaffanculo,2023-11-14,anger
"esempio me vicino. tizio poco raccomandabile, due denunce due ragazze violenza, due rischiato essere sfigurata l'acido l'ha mancata. dici te scopri dopo. ok. terza preferito lui, sapendo benissimo cose scritto. posso avere difetti vuoi, noioso, brutto, mostro, ok, buttatemi canale copritemi terra, scegliere lui, sapendo cosa fatto, vuol dire andare chiedere mondo cose vadano male. infatti...",2023-11-14,anger
"pubblicità. sapersi vendere. mica detto. ""ah sì. quasi sfigurata meritato poi tocca te.""",2023-11-14,joy
scegli morte noia. scegli persona sa rendere interessante noiosa. fatto. morte scopri dopo.,2023-11-14,sadness
metto dubbio. morte noia cosa scegli ?,2023-11-14,anger
voglio vincere nulla farti capire crimine crimine indipendentemente compie. bisogna fare attenzione singole persone senza guardare sesso. discorso chiude qui. scrivi sola sillaba blocco.,2023-11-14,anger
a.,2023-11-14,sadness
vuoi tiro fuori donne sfregiate date fuoco? vinci discussione.,2023-11-14,anger
"casi ce vuoi. sola vittima troppa va sminuita: [daniele polacci sfregiato l’acido: ""presto libera, giurato vendetta""](https://www.ilgiorno.it/cronaca/aggredito-con-acido-vendetta-daniele-polacci-2713520d) [la fidanzata l'ha sfigurato l'acido: ""questo calvario""](https://www.bresciatoday.it/cronaca/william-pezzulo-operazione-.html)",2023-11-14,anger
"eh si, numeri mano proprio uguale!",2023-11-14,joy
partner accuratamente scelte friendzonando ogni possibile buon candidato,2023-11-14,joy
>partner accuratamente scelte saputo vendersi meglio ogni possibile buon candidato magari bravo ragazzo interessante medusa spiaggiata. fixed,2023-11-14,joy
perso mamma anno fa. penso quel povero papà.,2023-11-14,sadness
penso povero padre perso pure moglie quest anno...,2023-11-14,sadness
papa video ovviamente spezzato im due dolore. papà terrore giorno proverò quel dolore.,2023-11-14,sadness
"leggo giro madre è,morta, probabilmente voleva essere abbandonato nuovo uccidere essere abbandonato, cazzata, mai fidanzata essenzialmente tipo tranquillo, ce farle male peggio piuttosto essere abbandonato forse timido l'abitudine tenermi dentro, ce proprio farle male",2023-11-14,anger
"mancano sabato, stati sentiti litigare vicino, cellulari entrambi spenti. premesse sperare bene.",2023-11-14,fear
shakespeare be like: filippo giulia?,2023-11-14,joy
speriamo no qualcuno trovi modo farlo soffrire. morire troppo facile,2023-11-14,sadness
vicino be like ![gif](giphy|3ohhwmblmtmwreqsxi),2023-11-14,joy
"notizia poco fa scientifica trovato tracce sangue luogo visti l’ultima volta. storie genere finiscono male, purtroppo, sentono spesso. spero sbagliarmi",2023-11-14,sadness
chiedo sempre caso meno forzare figlia prendere lezioni autodifesa arti marziali. forse potrebbe fare differenza giorno,2023-11-14,anger
letto ora cercando fiume infatti. angoscia.,2023-11-14,fear
"spero ritrovino presto risolva ""solo"" rapimento. conosco paese ragazza, purtroppo affaccia brenta, fiume noto decenni ritrovamenti vittime omicidi suicidi. ultimi tempi giornali c'era almeno adolescente suicida ogni anno :(",2023-11-14,fear
"purtroppo casi sappiamo qual finale, l'unica cosa fare aspettare scoperta corpi. probabilità ragazza ancora viva infinitesimali abbastanza probabile ucciso lui.",2023-11-14,fear
"ex fidanzato-litigio-lui strattona fa salire forza macchina-scomparsi.. finisce sempre stesso modo, si! colpa mettete bocca parole detto.",2023-11-14,anger
"abbastanza chiaro riferisse “queste situazioni”, dicendo finiscono sempre modo. interpretato “le relazioni fra uomo donna finiscono sempre stesso modo” evidentemente coda paglia quinta elementare ancora difficoltà comprendere testi scritti.",2023-11-14,sadness
"quando donna scompare stata vista l'ultima volta l'ex, sì, finisce sempre unico modo",2023-11-14,joy
bro comprensione testo colpa,2023-11-14,anger
">la causa femminista viene decisa uomini, permetti. esatto, viene decisa indiscriminatamente.",2023-11-14,anger
"causa femminista pagliacciata quando deciso donne quando fa comodo uomini sempre quando fa comodo. sembra potremmo essere nuovo fronte all'ennesimo (e spero vivamente no) odio donna verso uomo. ""non credo debba preoccupare contrario."" ah no? vivi sotto roccia? contatto realtà?",2023-11-14,anger
99% casi.,2023-11-14,fear
nessuna. rileggi scritto magari capisci essere partito tangente aver scritto cagata.,2023-11-14,anger
"""finisce sempre unico modo"" sempre",2023-11-14,joy
>finisce sempre unico modo. partiti weekend lungo tornano oggi dopo aver riallacciato rapporti?,2023-11-14,sadness
scusa concetto vorresti esprimere? molto chiaro. fin ora l'unico sciacallo qui tu.,2023-11-14,anger
chissà finali possibili storia... tappati bocca prima.,2023-11-14,anger
"vedo situazione dinamica prettamente personale rifletta qualche modo l'essere donna donne generale, l'essere uomo uomini generale.",2023-11-14,sadness
"pacchi cosa? fatto spari zero senza sapere ancora nulla? su, questione femminismo maschilismo. parlare fatti mano.",2023-11-14,anger
"credo pensiamo ogni volta leggiamo notizie genere. spererò, sempre, sbagliarmi",2023-11-14,anger
modo asfaltato downvote é assurdo.,2023-11-14,anger
pensa forse ciò temo?,2023-11-14,fear
"sembra storia coinvolti due uomini, quindi giustamente donne sentono tirate causa. vedo maschilismo pacchi, eh",2023-11-14,anger
coda paglia?,2023-11-14,anger
probabile omicidio suicidio. categorizzare femminicidio senso,2023-11-14,anger
ex accetta fine rapporto ammazza partner letteralmente definizione femminicidio,2023-11-14,anger
quando donna uccidere compagna ? sempre colpa uomo ?,2023-11-14,anger
"santo iddio, rispondere commenti stessa cantilena. capito redpillato mangiato misoginia crede essere categoria oppressa, davanti cazzo probabile rapimento omicidio abbi decenza fare silenzio.",2023-11-14,anger
"ragione, uomini stupratori, dobbiamo elaborare piano sterminio. p.s. trans consideriamo pure? cazzo intendo",2023-11-14,anger
"lolllll veramente divertentissimo quando buttate zappa piedi livelli, 0 self awareness proprio. esatto, 1 singolo caso isolato accade volta ogni mezzo secolo vs 1938283718281718 casi uomini stuprano, uccidono, picchiano rapiscono donne sfera familiare, conosciute sconosciute all'ordine giorno globo. rapporto sicuramente molto equo, già. poi cavernicoli fate finta interessarvi statistiche violenza uomini parte donne (per tratti pochissimi casi documentati rispetto all'opposto, quando succede prendete pure culo ""haha picchiare femmine"" ""haha stupro maschile esiste realtà qualsiasi maschio normale sogna farsi stuprare femmine haha gay haha"") solo esclusivamente quando tratta polemizzare tirare ballo kattivissime donne™ privilegiate rovinano poveri uomini nessuno pensa vere vittime società !!!!! semplicemente coda paglia fondo fondo (forse nemmeno tanto fondo) uomini violenti identificate empatizzate certi versi giustificate. posto silenzio meglio. comunque, plurale woman women. ciao.",2023-11-14,anger
posto silenzio. immagina uomo dice donna. poi immagina parola uguaglianza tanto sbandierate. poi immagina appena detto me. quindi secondo te femminismo uguaglianza significa dire donne posto silenzio ?,2023-11-14,anger
1 singolo caso isolato? seria ? fa pena.,2023-11-14,anger
sappiamo benissimo cos'è accaduto ecco stampa italiana incel schiuma bocca urlando not men avvieranno campagna pena pietà miseria probabile assassino dando colpa [tira freccette] depressione [gira roulette] solitudine [tira dadi] povero ancyelo educatissimo salutava sempre [pesca carta] l'ha uccisa troppo amore divorava,2023-11-14,anger
"livello comprensione testo sotto commento sinceramente imbarazzante. comunque sì, spero tanto sbagliarmi pensato anch'io stessa cosa.",2023-11-14,anger
"tutte, confermo. fa abbastanza schifo pensare aver già tirato somme prima qualunque accertamento merito, ancora schifo pensare ogni probabilità ragione",2023-11-14,anger
incel,2023-11-14,sadness
"me sembra psicologo serva te, esci stanzetta finisci fare troll",2023-11-14,anger
"colpa mentalità incellati merda pensano possedere donne senza relazione riescono vivere, sempre lamentarsi senza automigliorarsi fatevi giretto psicologo ogni tanto, redpillati",2023-11-14,anger
"semmai contrario, ragazza fa ammazzarla ? oggetto, proprio base ragionamento. bicicletta cadere bicicletta? accusando vittime essere carnefice",2023-11-14,anger
"l’ultima volta stati avvistati zona fossò. stamattina fossò trovato molte tracce sangue strada, l’hanno chiusa ore fare rilevamenti. dio povero, spero coincidenza.",2023-11-14,sadness
copione visto rivisto purtroppo.,2023-11-14,sadness
porco mondo,2023-11-14,sadness
successo romagna ragazza ammazzata famiglia.,2023-11-14,anger
"correggo solo punto, ragazza perso mamma :(",2023-11-15,sadness
"bene, quindi c'è solo ragazzo riesce metabolizzare ragazza lasciato puoi rapirla ucciderla rifiuta tornare te diamine gente educateli figli, sennò succedono ste storie, ragazzo depresso vuoi, fa uccidere ragazza dice amare?",2023-11-15,anger
"paragone. son due assunti stanti entrambi rispecchiano due realtà. gente paura stranieri estranei, fatto 1, stragrande maggioranza femminicidio avvengono invece famiglia tramite persone legate sentimentalmente (cosa estraneo straniero solitamente è) ritenta.",2023-11-16,fear
###rispetto reciproco permessi insulti gratuiti simili mancanze rispetto. https://www.reddit.com/r/italia/wiki/rules,2023-11-16,anger
"però, riconoscendo meno, significa tratta problema considerare?",2023-11-16,fear
"oggi doveva laureare. rimasto indietro accettava lasciato, laureare trasferire un'altra città continuare studi. l'ha chiaramente rapita tarparle ali probabilmente uccisa. immagino ucciso punto.",2023-11-16,joy
cristo santo orrore,2023-11-16,anger
"depressione (proprio generale) comunque condizione clinica, dunque elemento fattuale prendere considerazione ogni caso.",2023-11-16,fear
"descrivere persona depressa significa giustificarla. soprattutto descrivendo possessivo, manipolatorio, manie controllo, geloso probabilmente depresso. fare cherry picking serve nulla, l'onestà intellettuale grande pregio.",2023-11-16,anger
"fatto sola? ignori stampa italiana già iniziato campagna redenzione mediatica pazzo merda 99% fatto fuori ragazza poi suicidato, cose ""era depresso fatto esami"". succede sempre. tappi orecchie giri testa ogni femminicidio problema mio. comunque lesbica, cazzo lunghezza media sa te devi procurare forse meglio 💋",2023-11-16,anger
"spray peperoncino, legale italia. acquistabile persino online, ovviamente bisogna usarlo situazioni giustificate classificato vera propria arma. corsi autodifesa punto bianco funzionano avviso, situazione vero pericolo troppe variabili tener conto",2023-11-17,fear
###rispetto reciproco permessi insulti gratuiti simili mancanze rispetto. https://www.reddit.com/r/italia/wiki/rules,2023-11-18,anger
"[questo articolo](https://www.open.online/2023/11/18/filippo-turetta-omicidio-giulia-cecchettin-ricostruzione/) > l’indagine cadaverica esterna stata svolta medico legale antonello cirnelli, presenza sostituito procuratore pordenone andrea missier. giovane presentava, secondo risulta all’ansa, numerose ferite difesa mani braccia. turetta poi disfatto corpo giovane depositandolo bordo strada facendolo poi rotolare giù dirupo cinquantina metri, secondo ricostruito forze dell’ordine. momento conosce data esatta morte giulia, né v’è certezza momento giovane già morta quando stata lanciata dirupo. secondo appreso, momento ritrovamento oggi fondo canalone pressi lago barcis capo giovane coperto sangue, visibile strada nascosto enorme masso. tizio bestia",2023-11-18,fear
>al momento conosce data esatta morte giulia secondo fatto quotidiano notte sabato domenica.,2023-11-18,sadness
cosa migliore fare partecipare,2023-11-18,joy
">non salva nessuna piattaforma neanche mastodon purtroppo. fine conta può essere ""diversa"" piattaforma utenti sempre stessi.",2023-11-18,anger
"speravo salvasse, tipo già foto riuscito trasmettermi solo inquietudine instabilità sguardo. giulia sembrava anima pura genuina, sempre sorriso scatti. dispiace molto. inoltre omicidio ricordato tremendamente questo: [https://www.fanpage.it/esteri/le-ultime-ore-di-gabby-petito-nel-diario-del-fidanzato-soffriva-ho-messo-fine-alla-sua-vita/](https://www.fanpage.it/esteri/le-ultime-ore-di-gabby-petito-nel-diario-del-fidanzato-soffriva-ho-messo-fine-alla-sua-vita/) manca solo tipo sensi colpa tolga vita dinamiche/il contesto gelosia tristemente simili.",2023-11-18,sadness
">bhe problemi mentali capisce meno capisce affatto proprie azioni conseguenze suddette direi capisce eccome caso, altrimenti motivo fuggire?",2023-11-19,anger
">non capisco senso ridurre pena allora, tanto spiegazione delitti genere ricondurre problemi mentali vero spiegazioni casi >per motivo dovrei ridurre pena problemi mentali? dov'è nesso? bhe problemi mentali capisce meno capisce affatto proprie azioni conseguenze suddette",2023-11-19,anger
ok discorso partito dall'altro utente praticamente congetturato senza l'ombra dubbio ricevuto sconto pena infermità mentale. volevo solo capire base cosa...,2023-11-19,anger
"dicendo danno l'infermità mentale tutti, pare strano.",2023-11-19,anger
">non questione amico famiglia, questione difesa può girarsi medici famosi nord italia finché trova certifichi l'infermità mentale 99 dicono dice secondo ascolto? >tra l'altro famiglia molto benestante quel letto, quindi potranno permettersi medici fama molto importante. poi medico fama motivi personali dovrebbe mentire rischiare mettere rischio carriera salvare tizio manco conosce? soldi? dessero mazzetta milioni euro potrei pure capire dubito abbia...",2023-11-19,anger
"questione amico famiglia, questione difesa può girarsi medici famosi nord italia finché trova certifichi l'infermità mentale. l'altro famiglia molto benestante quel letto, quindi potranno permettersi medici fama molto importante. momento medico dichiara l'infermità mentale l'altro no poi parola esperto parola altro. quindi 50/50 danno l'infermità mentale.",2023-11-19,anger
"parli turetta mai detto problemi mentali, potrei saperlo? né conosco né medico",2023-11-19,fear
"accusa può richiedere parere altro medico, porti amico famiglia franca...",2023-11-19,sadness
te prende me l'autore codice penale italiano ahaha,2023-11-19,anger
sembra assurdo appurare l'infermità mentale posteriori,2023-11-19,anger
"""studiava ingegneria"" ...scusa?",2023-11-19,anger
"accoltella ventenne 20 volte testa poi butta giù ponte psicopatico totale, vuole medico fare diagnosi...non così difficile diagnosticare infermità mentale casi...",2023-11-19,anger
sai processo difesa può portare proprio medico fare diagnosi? sa capito funziona tribunale.,2023-11-19,anger
"capisco senso ridurre pena allora, tanto spiegazione delitti genere ricondurre problemi mentali. motivo dovrei ridurre pena problemi mentali? dov'è nesso?",2023-11-19,anger
"infatti bravura dell'offesa dimostrare premeditazione dell'omicidio dimostrare c'è nessuna malattia mentale mezzo. quando riguarda senso, codice penale l'ho mica scritto io.",2023-11-19,anger
"avvocato sveglio dice giudice ""eh onore vede assistito tornato veneto poi stato girare austria germania. stato giusto testa invece fare giro cucco fuggito qualche repubblica bananoske.""",2023-11-19,anger
"ovvio, c'è gente thread dà già deciso fatto l'assassino sconterà quasi nessuna pena.",2023-11-19,anger
"ruolo, l'avvocato mica decide pene capi d'accusa semplicemente mette dubbi/cerca togliere certezze giudici. cazzate deciderà giudice, avvocato oggi lista spesa relative info aiutare assistito creare buchi possibili evitare capi d'accusa",2023-11-19,anger
"dovrebbe dare credito cazzate dell'avvocato ""sveglio"" perché?",2023-11-19,anger
stato confusionale dopo 800km?,2023-11-19,fear
"35 fuori, soprattutto magicamente l'han beccato ""in stato confusionale"" investono buon avvocato.",2023-11-19,fear
"guarda decidere problematiche meno compito medici,non cosa viene decisa caso",2023-11-19,anger
"capito, studia ingegneria può avere problemi mentali? anzi, dirò disturbati visti proprio banchi facoltà ahaha",2023-11-19,fear
"secondo te qua verrà riconosciuta? ormai storia trita ritrita. omocidio, colpevole difende scusa dell'infermità mentale pena abbreviata.",2023-11-19,anger
studiava ingegneria l'omicidio premeditato. infermità mentale cazzo.,2023-11-19,anger
###incitamento all'odio permessi contenuti costituiscono incitano all'odio basato identità vulnerabilità. https://www.reddit.com/r/italia/wiki/rules,2023-11-19,anger
"macherebbe, famiglia va toccata. stronzo",2023-11-19,anger
"eh fa pagare prigione? 22 anni andava all' università, cosa fa? prende banconota l'annaffia giorni speranza cresca pianta soldi?",2023-11-19,anger
"mai sentito parlare concetto lavoro? impiegano proprio tempo proprie energie remunerazione, devi soldi qualcuno lavori prendi cazzo finché ripagato debito, così dovrebbero fare, invece tenerli cazzeggiare cibarli giorno mandi fare cose creano valore società",2023-11-19,anger
"chiama processo civile. verrà sicuramente chiesto risarcimento famiglia. magari assicurazione casa famiglia copre danni causati terzi componenti famiglia, peggiore casi ritroverà debito milioni euro potrà mai avere nulla suo, neanche galera",2023-11-19,anger
"parlando debito società, famiglia vittima, ovvio esista. società intera fatta carico spese dovute conseguenze crimine dovrebbe risarcire noi.",2023-11-19,anger
"sicuramente macchina, poi qualche risparmio dato famigliari genitori sentono minimo colpa aver visto segni avvertimento sicuramente aiuteranno pagare.",2023-11-19,anger
"ah, quindi peso stato famiglia. ottimo…",2023-11-19,joy
"meno male qualcuno grado scindere famiglia dall’elemento singolo. tutta gente parla violenza, confronti famiglia sua, tanto meglio persone lui.",2023-11-19,anger
"infatti vergognosi, sparano sentenze destra sinistra solo telefono glielo permette. sicuramente genitori soffrendo pene dell' inferno, figlio omicida famiglia anni potrà mettere naso fuori casa senza essere infangata, dev'essere passeggiata....",2023-11-19,anger
"appunto, dico sistema dovrebbe prevedere oltre pena temporale conseguenza crimine sè, “pena economica” conseguenza spesa sostenuta società condannare via definitiva",2023-11-19,anger
ogni giorno passato carcere paga. quando esci presentano conto.,2023-11-19,anger
"vabbè, concetto carcere rieducare riabilitare, punire.",2023-11-19,anger
modificato commento originale chiarire cosa intendevo preciso 🙂,2023-11-19,joy
ah no?,2023-11-19,anger
"beh sicuramente dover pagare avvocati ecc ste cose vanno sempre lunghe economiche. amico stato beccato sopra 0,50 macchina solo avvocato speso 3/4 k, figuriamoci sti casi.",2023-11-19,anger
beh sbagliato far pagare tutta famiglia qualcosa fatto solo.,2023-11-19,anger
"turetta uscirà prigione quando 40anni, potrete ritrovarlo fidanzato figlia sorella",2023-11-19,anger
"auguro sorella, pena peggiore carcere",2023-11-19,anger
https://preview.redd.it/634dg5uuab1c1.jpeg?width=1063&format=pjpg&auto=webp&s=cca9eaf9d89a478e896348547cd29b0a1198c00e,2023-11-19,joy
"impazzendo 3 mesi casa comfort, farsi 20 anni chiuso stanza 4x4 compagni cella gente proprio normale, senza sapere cosa succeda mondo vedendo luce sole 1h/gg passeggiata salute. sopratutto ridotte carceri italiane, persona viene situazione tranquilla abituato vita strada.",2023-11-19,anger
"nessuno dice passeggiata salute (ci mancherebbe solo pd), punto merda dovrebbe, minimo, mai uscire stanza 4x4 invece...",2023-11-19,anger
parlo lockdown? periodo bello vita,2023-11-19,joy
"dici tu, paese giustizia esiste. irrealistica ipotesi daranno vent'anni realistica gliene daranno uscirà dopo quattro buona condotta. piaccia meno, realtà fatti.",2023-11-19,anger
pietro maso però venne riconosciuta semiinfermità mentale venne dato indulto,2023-11-19,anger
"pietro maso fatto 22 anni, dubito costui più. uscirà intorno (ad avere sfiga) 45 anni.",2023-11-19,sadness
"concordo, italia, possibile",2023-11-19,fear
"anzi,lo troverai qualche tivù parlando molti delinquenti italia dopo rilascio...",2023-11-19,anger
esattamente. consegnato fingendosi pentito schizofrenico fatto massimo 10 anni dentro.,2023-11-19,anger
fortunatamente leggi italia abbastanza schifo fatto notare... /pd,2023-11-19,anger
"ok, ragione, pur sempre assassino italia. massimo 2035 fuori.",2023-11-19,anger
possibile rito abbreviato reati puniti l’ergastolo,2023-11-19,anger
"quando mai, rito abbreviato neanche possibile casi. mai nessuno fatto 10 anni d icarcere omicidio volontario diciamo cazzate",2023-11-19,anger
">mai nessuno fatto 10 anni carcere omicidio volontario città uscito dopo 11 anni scontati aver assassinato ex amante pistola, fatto rito abbreviato. credo stavolta andrà diversamente l'assassino tentato perseguire l'impunità scappando, considerata un'aggravante, comunque rito abbreviato farsi 10 anni omicidio assolutamente due cose possono succedere. edit: allego fonte https://www.ilgiornale.it/news/massacr-l-amante-ora-dovr-anche-risarcire-figlio-e-parenti.html",2023-11-19,anger
rito abbreviato può essere richiesto reati punibili pena dell'ergastolo qualche anno,2023-11-19,anger
"stronzo ammazzato fidanzata briciole pane, 54 coltellate, già uscito obeso?? fatto paio anni forse! vergogna!",2023-11-19,anger
