Comment,Date,Emotion
ragazzi commenti paura. esiste davvero gente pensa così?,2023-08-30,fear
così tanti commenti gente allibita commenti trovo suddetti commenti. breve storia molto allegra.,2023-08-30,joy
"allibita commenti… c’entra niente questione genitorialità, impagnatiello assassino basta. stata possibilità rifiutare paternità l’avrebbe uccisa, cambiato niente perchè pazzo malato! capite parte problema",2023-08-30,anger
"giustizia italiana ce mette proprio tutta risultare circo, solo clown ridere.",2023-08-30,anger
"piccolo appunto: renderei obbligatorio gip esso quando emette sentenza assoluzione alleggerimenti casi limite esempio poteva, caso specifico, configursi premeditazione crudeltà...a me pare evidente guardi ammazzare qualcuno mesi anticipo po' ""pensato""",2023-08-30,anger
"scorrere commenti fa venire brividi. seriamente giustifica assassino modo? chiunque provi buttarla discriminazione maschile fatto genitorialità forse ancora reso conto questo: qua c'entra niente parità genere, prima essere uomo ucciso donna incinta, persona uccise due. pertanto andrebbe condannato massimo pena. punto.",2023-08-30,sadness
"persone commenti capito un'assurdità pensare uccidere. giusto pensare feto debba essere voluto entrambi genitori solo madre giusto pensare fidanzato/marito debba uccidere entrambi. impossibile giustificare azioni genere tratta genitorialità. distinguete bene cose perché, parlate, state dando minima ragione abominio dell'umanità.",2023-08-30,anger
"modesto avviso solo c'è premeditazione, dovrebbe essere processato duplice omicidio, visto fuori dell'utero materno sette mesi gestazione bambino ""feto"" può sopravvivere. paese oltre all'ostinata cultura perdonismo ogni costo vuole mettere mano seriamente codice penale alcuni tipi reati l'efferatezza crudeltà meriterebbero alcun tipo perdono. impagnatiello lucidamente deciso uccidere donna bambino, cercando poi liberarsi dell'incomodo maldestri tentativi peraltro vilipeso corpo povera ragazza. gip pincopallo c'è l'aggravante crudeltà. gravissima mancanza rispetto vittime.",2023-08-30,anger
leggere commenti,2023-08-30,joy
"pezzo corriere migliori sembra ben fatto. testo dell’articolo legge: “alessandro impagnatiello, reo confesso, riferito magistrati aver agito «senza reale motivo», dicendosi «stressato situazione venuta creare» (la scoperta doppia vita)”. fronte ciò vorrei chiedere qui presenti frotte paladini maschi bianchi eterosessuali, sempre castrati: “avete esagerato bianchini passati direttamente all’antigelo?”",2023-08-30,anger
"it looks like op posted an amp link. these should load faster, but amp is controversial because of [concerns over privacy and the open web](https://www.reddit.com/r/amputatorbot/comments/ehrq3z/why_did_i_build_amputatorbot). maybe check out **the canonical page** instead: **[https://milano.corriere.it/notizie/cronaca/23_agosto_28/senago-le-ricerche-di-impagnatiello-mesi-prima-di-uccidere-giulia-tramontano-incinta-come-avvelenare-un-feto-364e8025-8269-4f3b-ae85-e0908a89cxlk.shtml](https://milano.corriere.it/notizie/cronaca/23_agosto_28/senago-le-ricerche-di-impagnatiello-mesi-prima-di-uccidere-giulia-tramontano-incinta-come-avvelenare-un-feto-364e8025-8269-4f3b-ae85-e0908a89cxlk.shtml)** ***** ^(i'm bot | )[^(why & about)](https://www.reddit.com/r/amputatorbot/comments/ehrq3z/why_did_i_build_amputatorbot)^( | )[^(summon: u/amputatorbot)](https://www.reddit.com/r/amputatorbot/comments/cchly3/you_can_now_summon_amputatorbot/)",2023-08-30,fear
"momento tristemente pieno coglioni incel redpillati, fallacie logiche correlare l’incidenza femminicidi all’obbligo paternità seguenti: 1) esiste nessun modo mettere relazione due dati, quindi un’”idea” tanto sensata dire “basta fumare becchi tumore polmoni”. esisteranno casi paura paternità uomo ucciso, totalità casi (e naso, nemmeno significativi), può generalizzare pensando scalfire solo minimamente statistica. 2) problema individuo atteggiamento violento antisociale, rispetto moltitudine atteggiamenti possibili, problema contesto, problema l’individuo. l’italia terzo paese mondo pochi omicidi, primati quali dovremmo andare fieri, significa orribili, fenomeni pochi. significa mediamente problema doversi accollare paternità porta l’uomo medio sbarellare uccidere compagna, parlando atteggiamento antisociale esibito molto meno dell’1% popolazione. chiedo violenza repressa frustrazione possa essere cervelli bacati arrivare fare solo lontanamente paralleli genere. così arroganti pena, costretto darvi coglioni…",2023-08-30,anger
nn coraggio leggere venendo piangere,2023-08-30,sadness
schifo gente ... mamma venendo pelle d oca,2023-08-30,anger
maaa cazzo me frega?,2023-08-30,anger
"benvenga scrive cosa pensa. falsi scrivono cosa giusto scrivere, beh possiamo vivere senza ovvietà",2023-08-30,anger
"problemi risolverebbero, almeno parzialmente, l'uomo possibilità riconoscere bambino mentre ora tutte decisioni prende solo esclusivamente madre.",2023-08-30,sadness
basterebbe permettere uomini rifiutare genitorialità invece obbligarli pagare mantenimento cose succederebbero.,2023-08-30,anger
giusto escludere crudeltà. premeditazione so. attenzione farci prendere smanie americane. valutiamo cervello italiano. poi penso ogni caso premeditazione possa essere aggiunta correggetemi sbaglio.,2023-08-30,anger
"it looks like op posted an amp link. these should load faster, but amp is controversial because of [concerns over privacy and the open web](https://www.reddit.com/r/amputatorbot/comments/ehrq3z/why_did_i_build_amputatorbot). maybe check out **the canonical page** instead: **[http://www.ansa.it/lombardia/notizie/2023/05/31/incinta-scomparsa-il-fidanzato-indagato-per-omicidio_fe297a61-7f46-42e5-8efd-2aaefa328e22.html](http://www.ansa.it/lombardia/notizie/2023/05/31/incinta-scomparsa-il-fidanzato-indagato-per-omicidio_fe297a61-7f46-42e5-8efd-2aaefa328e22.html)** | canonical: **[/lombardia/notizie/2023/05/31/incinta-scomparsa-il-fidanzato-indagato-per-omicidio_fe297a61-7f46-42e5-8efd-2aaefa328e22.html](/lombardia/notizie/2023/05/31/incinta-scomparsa-il-fidanzato-indagato-per-omicidio_fe297a61-7f46-42e5-8efd-2aaefa328e22.html)** ***** ^(i'm bot | )[^(why & about)](https://www.reddit.com/r/amputatorbot/comments/ehrq3z/why_did_i_build_amputatorbot)^( | )[^(summon: u/amputatorbot)](https://www.reddit.com/r/amputatorbot/comments/cchly3/you_can_now_summon_amputatorbot/)",2023-06-01,sadness
